comment	rating
Все парковки для инвалидов заняты машинами без соответствующих знаков. Людям лень сделать несколько дополнительных шагов, а инвалидам приходится ковылять издалека.	0
Детская больница скорой помощи. Вечный карантин. Лежит ребёнок 7 лет после хирургической операции. К ребёнку не пускают. Карантин. В области эпидемии нет. Решили сами, потому что родители мешаются. Советская медицина в полный рост.	0
Круто приходите не пожелеете, подготовлены артисты, отличное предстовление...возмите только подушку с собой - кресла "некакие" и обозначения рядов и секторов нет, можно спросить у специально стоящих работников цирка, уставших от вопросов …	1
Красный Факел мой любимый театр! Мне кажется, он действительно лучший в городе. Если театр, то только КФ! Я хожу туда уже пол жизни, больше 20 лет. Наиталантливейшие актеры! Ирина Кривонос, Константин Телегин, Владимир Лемешонок, Павел …	1
Отличный сетевой магазин но цены не радуют глаз даже с картой, очень сильно всё подорожало. Парковка отличная!	1
Нормально для гипермаркета. Парковка очень вместительная. Из недостатков, бывает касс работает мало, поэтому образуются очереди... В кафе грязно, не качественная еда.	1
Достопримечательность Новосибирска. Шикарный театр как внутри , так и снаружи. Большой репертуар. Цены приемлимые	1
Очень красиво и стильно сделали набережную. Хоть я и была скептична сначала, но сделали удивительно хорошо, порядок поддерживается, это реально место для молодежных активностей, спорта и тихого спокойного отдыха.	1
Хорошее место для прогулок с детьми. Есть атракционы, кафе, уличная сцена и даже театр. Городские праздники проходят здесь организованно и весело. Ставлю 4 звезды за старые атракционы на которые билеты считаю, что сильно завышены. Хоть и понимаю, что центр города, но либо замените их, либо умерьте аппетит...	1
Чудесное место, были уже после заморозков, но пруд ещё не замёрз, так что было бесконечное количество голодных уток. Благоустроен, вокруг деревянные дорожки. Уток лучше всего порадовать комбикормом для домашней птицы или размоченной перловкой или ячменём, а то хлеба они наедаются тоннами)	1
Очень масштабное здание. Внутри все очень красиво  сделано. Много места.	1
Конечно, новый аэропорт на порядок лучше старого, это бесспорно. Здание просторное, светлое😍 Но! Есть много вопросов по поводу обустройства. …	1
Заросли, запущенность и неухоженность. Озеро. Скорее это лужа заросшая тальником и старыми сгнившими деревьями, где в это грязи плавают утки.	0
Михайловская Набережная - одно из лучших мест в нашем городе! Всё новенькое, красивое, а главное комфортабельное (перечисляю) : + Много удобных и внешне привлекательных скамеечек😍 …	1
Аттракционы оставляют желать лучшего, но фонтан с музыкой и небольшая детская площадка очень приятные	1
Отгрохоли с размахом и летаем только в нутри страны. Почему так мало регулярных за рубеж. Иркутский аэропорт вообще убогий и старый, но полётная программа на международные рейсы очень большая	0
Запрещают ученикам во время перемены сидеть на скамейках и диванчиках, которые изначально предназначены для УЧЕНИКОВ. ПОЧЕМУ дети должны сидеть на полу? Ладно, если бы называли причину, почему нельзя там сидеть. Но ведь многие учителя …	0
Очень уютное , комфортное место для отдыха , с друзьями и  парой влюбленных) Можно отлично отдохнуть , перекусить и под бутылочку вина насладиться замечательным актерским мастерством!	1
Никогда раньше не была на мероприятии такого формата: кафе-театр. Но понимаю зря! Уютная атмосфера, игра актера, как всегда на высоте! Приятные впечатления от вечера! Приду еще	1
Врачи молодцы!!! Очереди только большие очень много ребятишек....	1
В ночь с 13 на 14 декабря была проверка  ПБ. Пассажиры а Таиланда были заморожены,в последствии заболели.	0
Очень хороший магазин в плане акций всегда есть товар которого нет в других супериаркетах этой сити.	1
Выставки современных фотографов  это на любителя. В остальном всё однотипно как и во всех остальных городах России.	1
Иногда гуляю здесь, классное место, чтобы посидеть на травке или посмотреть на уток) Правда днем народу в выходных не протолкнуться, поэтому в основном здесь либо утром бываю, либо в будний. кафешек нет нормальных, только kfc и местные …	1
Здание не самое современное, но за неимением другого любителям цирка остается довольствоваться тем, что есть. Расположение бесспорно удачное - добраться можно любым транспортом. Радует просторная парковка, электронные билеты, довольно …	1
Отличный магазин для покупки продуктов. Неплохой выбор автотоваров. Немного хуже в плане игрушек и одежды, но можно найти и не плохие вещи и игрушки. Выбор рыбки тоже есть, но увы практически всегда не свежая. А в общем и целом, всегда можно найти, что хочется	1
Персонал ужасный! Позвонила узнать куда определили бабушку..мне нахамили, ничего не сказали а только перенаправили чтоб я звонила на следующий день с 11-17 в справочную. …	0
Это место прекрасно в любой сезон.	1
Ходили на Лебединое озеро. Три часа пролетело как мгновенье! Красиво, захватывающе! Восторг и восхищение! Живой оркестр чего стоит!	1
Кошмар. Очередь, духота. Полтора часа сижу, а конца не видно.	0
Очень понравилась )и в правду очень ценные и древние вещи хранятся желаю ещё процветания !	1
Вежливые сотрудники. Для инвалидов на коляске есть возможность воспользоваться лифтом и осмотреть все три этажа. Самая интересная экспозиция в цокольном этаже - история народов Сибири до прихода русских.	1
Живу рядом, покупаю только здесь продукты. В общем-то достаточно неплохой магазин, никогда не бывает различных просрочек порченого товара и других моментов которые присущи мелким супермаркетом. хромает ассортимент в основном присутствуют …	1
Театр с незабываемыми положительными эмоциями!!! Современно, креативно, живая игра актеров!!! Два с половиной часа как на одном дыхании. Спасибо всем кто принимает участие в в жизни театра!!!!	1
Были в театре на спектакле Аферисты 4 мая. Понравился и актерский состав и игра.Впечатление произвел и сам театр.	1
Душ в урологическом отделении временно не работает. Чистые палаты, уютная хоть и маленькая столовая в отделении. Мед персонал вежливый, тактичный.	1
Замечательный парк в центре города. Можно отлично провести время как с детьми, так и в компании друзей. Есть аттракционы для детей и взрослых. Множество разных кафе. Также в парке есть светомузыкальный фонтан. Разная музыка и разные режимы работы фонтана. Очень красиво. Вокруг фонтана есть лавочки.	1
Сам театр в прекрасном состоянии! Я помню, в каком ужасном состоянии он был в конце 80х-90х. Радует полный зал! Была 05.04 на вечернем спектакле "Лебединое озеро". Сам спектакль - еле досидела - "принц" просто ужасен! Весь спектакль с …	1
Были сегодня, 1 июня всей семьей. Прокатились на теплоходе до острова Кораблик. Цена билета 300 руб на взрослого. Ребенок наш прошел бесплатно. …	1
Шикарный театр!  Мы всей семьёй посмотрели практически весь репертуар Большой и Малой сцены. Очень нравятся постановки в кафе Красного факела  и музыкальные программы . Желаем больших творческих успехов всей труппе Красного факела !	1
Набережная с каждым годом становится все чище, интересные, оформляется креативно и красиво. Зачетные не лишние графити.. Единственная проблема это воспитать людей доносить мусор до урны, надо поставить пару плакатов соцрекламмы о чистоте. …	1
Хороший парк в центре города, где можно хорошо провести время как и семьям с детьми, так и только  взрослым. На сцене часто устраивают мероприятия, проходят баллы, концерты. В парке есть места где можно поиграть в шахматы и другие …	1
За постановку 5, за дешёвый коньяк стоимостью 500 рублей за 50 грамм - минус 3 звёзды... Это какой то бред(( с такими ценами в буфете театра даже хороший ресторан тихо стоит в сторонке....	0
Объясните, почему в новом аэропорту не объявляют по громкой связи регистрацию рейса как в других нормальных аэропортах. Я сегодня из за этого пропустила рейс, опоздав на 5 минут подошла к стойке, объяснила ситуацию на что мне девушка за …	0
Больница хорошая. Квалифицированный персонал, да есть минусы в палатах (Кровати жесткие и узкие ), чаю не попить , т.к нельзя чайники и кипяточку не дают. Но к врачам претензий нет , отлично делают свою работу.	1
Были на шоу Джамбо. Очень понравилось. Много воздушной гимнастики, щакарнре батутное выступление, ухоженные звери, яркие костюмы, персонал цирка приветлив, дружелюбен.	1
Люблю Ленту, удобно, комфортно, покупаю практически только по акциям . Сегодня вот поехала по акции кофе купить в том числе и не нашла именно по акции кофе))) а так магазин не большой ,удобный и много акций)))	1
Для уровня цирка миллионного города не хватает чистоты в санузлах и подьемников или лифтов для пожилых людей. Также не продумана вентиляция в холлах. Общее ощущение пошарпанности.	0
Шикарный театр.лучше я пока не видела.все просто невероятно красиво!	1
Это место притягивает своей атмосферой! Красивый интерьер, очень дружелюбный персонал. Постановки этого театра всегда проходят на Ура. Тектоника чувств и Только для женщин, для меня это фавориты!	1
Если нужно прояснить мысли или прогуляться на просторе - Михайловская набережная то, что надо👍! Здесь как нигде чувствуешь потоки энергий - воздуха и воды: ум проясняется, глаз …	1
Хороший гипермаркет. Всегда есть привлекательные акции. Можно все купить в одном месте. Всегда ходим закупаться в этот магазин	1
Очень нравится гулять по Михайловской набережной. Единственный минус - очень мало бесплатных качелей для детей. На набережной всего один бесплатный детский городок, на котором всегда куча детишек, и чтоб покачаться на качелях, приходится очень долго ждать	1
Отличное место приехать покормить уток, присесть отдохнуть, погулять с детьми. Очень здесь уютно.	1
Пруд страдает от недостатка воды, и это, кажется, все меньше нравится уткам. Скоро это может оказаться голубиный пруд	0
Есть место погулять, есть место посидеть, есть место покататься и попить кофе. Радует глаз цветовое разнообразие. Получили удовольствие от прогулки.	1
Уютно! Правда в последнее время людей стало больше... Хорошее место с детьми погулять. Возьмите с собой хлебушек, чтобы покормить уточек!	1
Выступление цирка на льду "Айсберг" очень хорошее, доброе и запоминающееся! После него не жаль болящих от смеха скул и отбитых ладоней.	1
Была не в самом театре, а в кафе на спектакле. Сказать, что в восторге-ничего не сказать. Игра, подача, атмосфера...  Очень интересно и необычно	1
Мне нравится театр Красный факел. Он,конечно,не огромен,но уютный буфет:кофе,чай,мороженое,бутерброды. Что немаловажно, большой женский туалет,очень быстрые гардеробщицы,долго не стоишь в очереди за одеждой. Только с парковкой туговато,но …	1
Цены в буфетах и кафе выше даже чем в Сочи. 2 ярус закрыли сволочи, фойе там тоже закрыто. Кароче изуродовали театр	0
Огромное спасибо от меня лично и от мамы!!!! Врачи от Бога!!!  Огромное спасибо всей бригаде скорой медицинской помощи. Огромное спасибо врвчу-анестезиологу-реаниматологу Каримову Жалолиддину Зайниддиновичу, а также врачу-неврологу Пчелко Любвье Николаевне. Огромное спасибо всему медперсоналу, очень замечательные!	1
Это супер врачи , нахожусь в челестно лицевой хируггии; Браво.	1
Великолепный театр 🎭. Прекрасная игра актёров, костюмы добротные, красивые, атмосфера, зал. Зрители тоже какие-то особенные 😂. Фото запрещены, а жаль. Прям кино на сцене. Цены на билеты средние по городу. Есть парковка на 15-20 автомобилей. Я покорена. Ребята советую данный театр. …	1
Как всегда прекрасно. Театр начинается с гардероба! Нас встретили приятные сотрудники, которые проверили сертификаты и удостоверение личности. И это сильно порадовало. Учреждение заботится о своём имидже и безопасности гостей. Спектакль был …	1
Замечательное место семейного отдыха, детская площадка, сухой фонтан, карусели, просто аллеи для пеших прогулок	1
Отличная набережная, приятно прогуляться с семьей	1
Сегодня на скорой привезли в приемный покой с инфильтратом ноги  и раной от нарыва. Не приняли. На инфильтрат сказали че это у вас, опрелости?! Орали что ездят тут по скорой а должны в поликлинике лечиться и не тянуть. А всё за 2 дня …	0
Здесь прошло мое детство😂 …	1
Удобные кресла. Зал очень вытянутый. Сцена довольно маленькая.	1
Прекрасно и величественно. Высоко профессиональный оркестр, труппа достойна столичной сцены. Браво.	1
Отличный театр и актеры. Стоимость билетов нормальная. 350 рублей за 8 ряд - амфитеатр, очень гуманная цена.	1
Посетили прекрасный концерт в Оперном театре. Тема - вальс. Ушли под большим впечатлением! Представление понравилось очень! Впервые мы увидели, что дирежер общается со зрительным залом, комментируя и представляя произведения. Это необычный …	1
Отличное представление The Best!!!	1
Очень рекомендую свозить деток,своих родителей и просто провести день с близкими! Съездить лучше в конце  июня,там ни мошки,ни комары не мешают, погода отличная. Мы  и поели и на фотографировались и один позитив...	1
Очень уютно и комфортно находится вечером и днём. Много места и хорошо организованное пространство позволяют приятно провести время. Есть место и детям и собакам)))	1
Акций очень много, цены низкие на большое количество товаров. Но фрукты/овощи/мясо лучше не брать. Мясо по акции пахнет уксусом при жарке. Овощи фрукты или зелёные или тухлые, но бывает и повезет	1
Очень хорошо погуляли!	1
Очень,очень великолепно и красиво,советуем всем!!!	1
приятная атмосфера и хорошие учителя	1
Прекрасный театр и артисты, лучшие и сильные в своем деле. Никогда не бывает спектакля без эмоций. Если быть в Новосибирске, обязательно быть и в этом театре.	1
Впервые побывала здесь и влюбилась в это место! Внимательный персонал, подсказывает куда идти, отвечает доброжелательно, в залах, туалетах и коридорах чисто! Нет большого скопления людей, можно свободно передвигаться до зала. Малый зал …	1
Шикарное место, но мало что осталось от прежнего. Кроме попкорна и мороженого детям купить нечего. Весь антракт простояли в очереди. Ни шаров, ни ваты сладкой.  Ещё и в гардеробе поторапливали быстрей свалить. Осадочек остался.	1
Очень увлекательное место. Чтобы все обойти, нужно не менее 3-4 часов, а если вы с детьми - смело прибавляйте 1-2 часа. Можно идти с утра перед кормом, но лучше к вечеру, когда основная масса уже разойдется. Есть лавочки для отдыха, для …	1
Чудесный балет 3D Золушка! Три действия на одном дыхании.	1
