comment	rating
В обновлённом театре была первый раз, раньше ходила часто, но последние 8 лет проживала в другом городе и не было возможности посетить НОВАТ. Все очень понравилось от гардероба до сцены! Персонал вежливый, опрятно одетый, в основном молодые парни и девушки встречают и провожают зрителей, проверяют билеты, следят за порядком в зале и фойе театра. Кресла в зале достаточно удобные, чтоб провести в них почти 3 часа. Мы сидели в высоком партере на 12 ряду, видно было отлично как общий план действий на сцене, так и можно было разглядеть лица и грим актёров. Буфет работает на втором этаже, но на каждом этаже есть столики с продукцией кафе: шампанское, бутерброды, пирожные.. Правда очередь в кафе огромная и можно не успеть за антракт перекусить. Если зритель опаздывает вернуться на свое место после третьего звонка, то он может продолжить просмотр в онлайн режиме на экране в кафе или попробовать войти в зал, но его могут посадить на другие свободные места, если таковые есть, чтоб не мешать другим зрителям. Выступление артистов балета очень понравилось, как и музыкальное сопровождение, свет, постановка, костюмы, грим, декорации и применение новых технологий в виде спецэффектов. Все на высоком уровне. Цены приемлемые по сравнению с Большим или Мариинским, если артисты местные, то от 500 до 3000 руб. Билеты в высокий партер стоили 2000 руб. Получила истинное удовольствие от посещения театра, обязательно приду еще!	1
Если можно было бы поставить 10 звезд то поставил. Уникальное место, атмосфера и представление!!!	1
Посетил спектакль "Почти смешная история". Уныло)	0
В последнее время попадаю сюда почему-то на чисто развлекательные спектакли. А в театре для меня это на последнем месте.	1
Хороший театр. "Щелкунчик" не очень впечатлил,  мало сказочности и цельности.	1
Один из хороших театров, но есть по лучше, в плане масштаба.	1
Самый любимый театр, но почему-то последний раз в буфете по пироженым бегал тараканчик	1
Театр с хорошей историей дает места в аренду для спектаклей сырым группам на непродуманные постановки.	0
Хороший театр много молодых интересных актеров , театрам сразу видно занимаются и технической частью и репертуаром ходил два раза остался доволен , приезжие москвичи курят	1
Очень красивый интерьер, много красивых фотозон, просто много места - нет толкучки, даже при полном зале! Аккуратный сервис: девочки ПРОСЯТ прекратить съемку спектакля, а не приказывают. Сам спектакль тоже был замечательным, очень красивые костюмы и добротное, без всяких "финдибоберов" , прочтение....обязательно вернемся еще...	1
Все очень плохо, в зале жуткий холод на утро после посещения театра проснулись с болью в голове, ушах. К холоду в зале, справа дул сильный холодный ветер. Кто хочет пойти на больничный сходите на спектакль в Глобус.	1
«Кинотеатр». Да и добираться сюда на авто.. мамма мия..	0
Замечательный актерский состав, великолепная игра. Каждый раз получаешь удовольствие от спектакля. Из минусов -только буфет, медленно и недостаточно посадочных мест.	1
Не люблю театры	0
Хороший театр, но ему бы ремонт сделать. Прекрасный спектакль смотрели Морозко, дети в восторге. Ярко и красочно. Хорошая игра актеров	1
Много посредственных спектаклей и их долго неснимают. Штукатурка сыпится с потолка. В малом зале за стулья очень дорогие билеты	0
Давно не была в Красном Факеле. Персонал приветливый. Зал был полный. Смотрела Продавец дождя. Игра актеров достойная. Современные приемы в постановке. Туалеты чистые. В кафе высокие цены и узкий ассортимент. Качество на 3. Видимо кафе не считают как вид дохода. В целом стало лучше,чем было 2-3 года назад.	1
Неклассические прочтения, игра актёров, харизма, юмор, отличное настроение в купе с послевкусием мыслей и ощущений от просмотренного, все это даёт 5звезд! Спасибо огромное, за то, что вы делаете!	1
Камерный театр. С середины зала, низ сцены видно не очень, но в остальном отлично и видно и слышно. Посмотрели легкую комедию, а это полтора часа приятно проведённого времени.	1
8 лет назад мне посоветовали сходить на спектакль "братишки". Все никак не могла купить билеты. Постоянно что то мешало.  То работа, то отсутствие денег, то ещё что нибудь. Но ,спустя 8 лет, попали с мужем на этот спектакль.... моё ожидание …	1
Во время выступления появилось такое чувство, что на сцену выпустили шизоидов под наркотиками и сказали "выступайте"	0
Последний раз были на спектакле Театра Наций "Фрекен Жюли". Зал очень удобен, из партера отлично видно и слышно отовсюду, даже с последних рядов. Но - если в одно время идут мероприятия и в Большом и в Малом залах, на входе и на всём первом этаже невыносимо тесно. Об очередях в уборную и в буфет (стойки которого расположены в нескольких местах первого этажа и тоже создают толчею) лучше просто промолчать в таком случае. Нам повезло на выходе - наш спектакль кончился раньше, чем в Малом зале.	0
Отличный театр. Красивый спектакль. Доступные билеты. Есть возможность переобуться и сложить свои вещи в ячейку.	1
Низкие цены на билеты, большой репертуар, хороший зал. Репертуар средний, в буфете постоянно половины нет 😁. От метро далеко, но вообще место неплохое. …	0
Спектакль отличный. Но мы с детьми очень замёрзли на 5 ряду, теперь читаем, как бы не заболели.	0
Настоящий дворец культуры и искусства	1
Очень классное место. Первый раз сходила с детьми они в восторге. Понравился индивидуальный подход актёров к зрителям, (детям). Знают что к ним нужен особый подход, чтобы где-то не испугались а где-то поучаствовали и не скучали. Обязательно схожу ещё.	1
Были в конце августа на спектакле "Братишки", просмотрели на одном дыхании! Потрясающая игра артистов! Удобный вместительный комфортный зал. Остались под приятным впечатлением, рекомендую к посещению!	1
Очень понравился спектакль Спящая Красавица! Давно не выходила куда - то. Скучала по театрам. Но есть одно но - дорогая еда. Но это даже не сильно огромный минус, потому что дорогая еда почти во всех заведениях.	1
Спектакли так себе, но свой зритель есть... Была на 2 спектаклях, ушла с обоих...	0
Отличное начало знакомства подрастающего поколения с театром. Все зависит от Вас и Вашего ребенка - можно пойти в год, два, три.. Я видела разные ситуации - кто-то в два года сидит и не моргает, настолько заинтересован сказкой.. Есть дети, для которых это больше похоже на наказание, чем развлечение и приобщение к прекрасному.. Выбор за Вами. Актерам, режиссеру, администратору, звукооператору, костюмерам и всем причастным к действу лицам - огромное спасибо!!!	1
Стулья на балконах неудобные, места для ног мало	0
Рекомендую место для посещения как детям так и взрослым. Малая сцена, это отдельная важная часть для посещения всем ,кто театр не посещал. Сколько переживаешь эмоций , сколько инсайтов приходит к тебе во время постановок. Браво режиссёрам и актерам. Воспитание и развитие человека начинается с театра.	1
Были на рок спектакле "Фома". Очень понравился. Кто не равнодушен к творчеству Юрия Шевчука,просто подарок. Всем любителям рока рекомендую! Артистам Браво! p.s коньяк в буфете зачёт.	1
Очень красивое место. Очень интересные представления. Вернемся еще не один раз.	1
Над этим надо хорошо работать	0
Ходили на спектакль "Волшебная лампа Алладина". Прекрасные декорации, красивые персонажи. Зал небольшой, что для меня +. Внутри театр очень красивый. Музей интересный.	1
21й век, а они до сих пор только головы от кукол надевают. За 500р за билет, можно и ростовые куклы показать	0
Прекрасный творческий коллектив! Уютный малый зал. Большой зал нуждается в реконструкции как и весь театр. Но при этом прекрасная атмосфера и целостное восприятие творчества.	1
Уютно, вроде и центр города, но тихо. Конечно хотелось бы побольше скамеек и скат для коляски у фонтана	1
Не все постановки удачны, особенно те, которые сделали на современный лад - стыдно за них:( а в целом роскошное место.	0
Сам театр как здание выше всяких похвал! Но спектакли-по  крайней мере Чук и Гек-это нечто совершенно серое , скучнющее и ужасное! Один "Гек" чего стоил-вроде это должен быть пацан лет 10ти. Куда там! Упитанная бабенка с мощным бюстом и лет таки 35ти! Просто безобразие! Неужели во всей труппе МОЛОДЕЖНОГО театра не нашелся один молодой парень на роль мальчишки!!!!	0
устаревший	0
Я не была в Большом театре, просто проходила мимо. Хотелось бы сходить на балет.	0
Свежий Кехманский ремонт уже дает трещины. Щелкунчик в новой постановке не понравился совсем :(	0
Великолепный театр! Побывала на балете "Дон Кихот"	1
Театр - это круто! Это одно из мест которое позволяет человеку остаться Человеком.	1
Всю взрослую жизнь мечтала увидеть и послушать Искателей жемчуга, и вот оно чудо - поставили в Большом, билеты куплены, томлюсь вся ожиданием чуда, подругу позвала. И вот сегодня - деньги вернули, спектакль отменён, на сайте ни слова, даже извинений нет! Вы что, люди, для кого вы работаете и ставите спектакли? Если для людей, то почему так себя ведёте, банально извиниться нельзя?	0
Поняли	0
отстой	0
Обновлённый театр не перестаёт удивлять. Его техническое наполнение выходит на международный уровень. Удобные не скрипучие кресла и ноги теперь можно вытянуть удобно. Появились места и подъёмники для маломобильных людей. Не знаю, есть ли какой то закон, определяющий рассаду во времена пандемии, но в кинотеатрах не рассаживают всех в ряд, оставляют по одному месту между группами. А в театре все плотненько сидят.	1
Побольше классических традиционных постановок бы! Нужно работать для зрителя. Устали уже от революционного новаторства. От современной оперной режиссуры остается дурное послевкусие ( за очень редким исключением).	0
Превосходный балет "Золушка"! Получили массу удовольствия и сказочное настроение в канун Светлого праздника Рождества!	1
Невероятно шикарное место, такая атмосфера, как всё красиво. Балет это отдельная красота тела. Рекомендую всем для посещения, попадаешь в какую то сказку. Перекусить есть где, но цены очень кусаются, бутерброд с рыбой 580 рублей, с красной икрой 700, это очень дорого, кофе 200 рублей, возможно для данного места это и нормально, но людей в буфете очень мало, можно сделать вывод.	1
Очень любим этот театр. Каждый год с дочкой ходим на новогодние спектакли. Всегда все красиво и безумно интересно	1
Театр не хуже чем у Одиссея @grimace	1
Норм зал, звук хороший	0
Прекрасный театр. Интерьер стильный, шикарная оранжерея. Эмоциональная игра актеров. Рекомендую посетить, получите массу удовольствия	1
Очень красивый театр и талантливая труппа.	1
Потрясающий театр, внутреннее убранство, прекрасные костюмы и декорации. Посещение этого театра - просто праздник!	1
Архитекторы не слышали о трибунах	0
Щелкунчик на троечку. Эконом вариант. Голая сцена, не богатые костюмы, урезанный по времени вариант	0
Была в Новосибирске в командировке, пошла на спектакль Гедда Габбер. Были в малом зале, очень не удобные стулья.	1
Ходили на детский спектакль. Впечатление восхитительно.	1
Отлично место для проведения семейных праздников а то не встречи нового года	1
Просто дыра	0
Как классический театр оперы и балета категорически не рекомендую. Все постановки на новый лад,современный взгляд-испорченные спектакли. Балерины танцуют кто куда,руки в разные стороны,одна уже прыггула,а доугая только собирается...танцоры быстро выдыхаются и хочется им помочь подпрыгнуть,докрутиться.  Дети не понимают,что происходит,люди встают и уходят на середине спектакля и я с ними солидарна. Если Вы любите что-то странное,модерн,классику на новый лад,то Вам понравится. А я всё еще не могу прийти в себя после новогоднего Щелкунчика... В общем,очень на любителя. Для классического ценителя будет шок. Не рекомендую. Выпускной хореографического училища вызывает намного больше положительных эмоций,чем спектакли из репертуара театра. На ребят хожу смотреть с огромным удовольствием. Мне есть с чем сравнить,поэтому я понимаю о чём говорю. Пожалуй,у меня всё.	0
С детства ходим в этот театр. Нравится.	1
Почему Морген не разает афтографы?!	0
Замечательный молодежный театр!) Очень интересно смотреть спектакли, актеры действительно стараются)) много современных постановок, каждая по своему исключительна!	1
Театр оперы и балета. А где опера-то? Зато дают  сразу две оперетты! Позор руководству!	0
Очень круто. Но мегаскушно. Как ни старался я спал. ))) был на балете и на опере. Спал и там и там...	0
Посмотрел вчера на большой сцене постановку Игрок по Достоевскому. Сегодня в казино не пойду.	1
Давно была в Глобусе. Малый зал был лучше. После переустройства очень плохо просматривается часть сцены, с некоторых мест приходится домысливать действие), как полуаудиоспектакль. Дальше 3-го ряда покупать билеты не советую. Актерам и режиссеру твердая 5. Тем, кто придумал сделать перегородки в малом зале, неуд. по специальности.	0
Капельдинеры просто ужасно относятся к обычным зрителям зала, а к иностранцам или випам через поклон. Должно быть равноправие, и возраст не показатель статуса в обществе или культуре. Балет это Наше наследие которое надо сохранить на века, а иначе через несколько лет все будут знать Бузову.	0
Приветствую) к своему стыду, я впервые  посетила балет, это было  чудесно, мы ходили всей семьей, в честь 70 летия моей мамы, юбилейный выход. Мне, маме и дочери понрасилось очень. Муж не понял, у него конкретное восприятие мира, сын вообще уснул у меня на плече, но сказал, что музыка - чудесная.)))	1
Всё хорошо, но хотелось бы, чтобы было больше парковок недалеко от театра.	1
Потрясающий театр, ничем не уступает столичным. Просторные хохлы, нарядная публика. Отличная акустика. Смотрели балет Спящая красавица💤👸. Прекрасная постановка! …	1
Не берите билеты на 4 ярус. Это под самой крышей, напротив огромной люстры. Если другого выбора нет, тогда берите центр, места 19-20, чтобы перед вами никто не сидел. Из-за дешевизны билетов аудитория тут тоже специфическая. Много шевелятся,кашляют прямо в зале, обсуждают. Входить и выходить из зала можно когда угодно. Один плюс этого яруса - главный буфет. Два пирожных и два чая обойдутся в 340р.	0
Я из Турции. Я посетила это место дважды. Я смотрела «Лебединое озеро» и «Аидо». Оба были превосходны. Все очень успешно. 🫶Сотрудники очень вежливы.🤍 Внутри потрясающе! 😻 Архитектурная легенда! 🧿Вам обязательно стоит посетить. 🙏 …	1
Спектакль был супер. Супер старс😊 А сам театр- ничего выдающегося. …	0
Были 5 мая. Ушли в антракте. В зале было невыносимо душно. Люди обмахивались брошюрами, зал был полный, а воздуха никакого. И очень тесно между рядами, сиденья жесткие и маленькие, у нормального мужчины сводит ноги.	0
