comment	rating
Экспонатов не так много. Видимо смотрители от делать нечего ходили за нами хвостом, даже как то неприятно. Из плюсов очень вежливые охранник на входе, кассир, и женщина в гардеробе.	1
Очень уютный и чистый сквер. Тенистые аллеи и величественная архитектура оперного театра. Очень понравилось это место. Жаль, не удалось побывать внутри, и посмотреть всё убранство здания. Обязательно посещу вновь, когда буду в Новосибирске вновь!	1
Хороший магазин, чисто , много товаров по акции,что приятно радует.	1
У нас в городе очень мало исторических зданий, поэтому каждое особенно ценно. Снаружи здание выглядит совсем небольшим, а внутри просторный, высокий, залитый светом зал. Не оставит вас равнодушным.	1
Есть все специалисты, по крайней мере, которые требовались мне,свежий ремонт, наличие бахил всегда, помощь при любом вопросе	1
Неогромный аэропорт, не потеряешься. Если летишь транзитом и из здания не выходишь, то повторно досмотр перед самим полётом не проходишь, это радует. Так работает на внутренние рейсы. В здании есть кафе и всё необходимое.	1
Широкий ассортимент продуктов питания и различных товаров народного потребления по низким ценам, но только при наличии дисконтной карты. Регулярно проводятся акции. Работает круглосуточно.	1
По сравнению с другими парками ЦП в идеальном состоянии. Приятно и кататься и просто гулять по ровным дорожкам. Доступны киоски с мороженным, коктейлями и т. П. …	1
Сегодня водитель маршрута 45 не выпустил несколько пассажиров из задней двери, пришлось через толпу пробираться к средней, но двери закрылись и водитель не соизволил снова нажать своими вонючими пальцами на кнопку. В итоге проехали свою остановку. Водитель - конченный ур@д. Чтоб ты жил триста лет и мучился.	0
Небольшой пруд с утками, вокруг по периметру деревянная тропинка. Удобно спускаться к пруду. Приходите с крупой, уточки будут очень рады.	1
Зоопарк в Новосибирске- отличный. Он огромный. Много животных в больших вольерах, огромные зелёные зоны, много кафе, плюс атракционы для детей, плюс перевёрнутый дом, избушка бабы яги. Я думаю, что Новосибирск стоит посетить только ради этого зоопарка	1
Огромный магазин,с огромным наличием товара и различной ценовой категорией.Можно купить и продукты питания и товары доя домашнего быта.Есть минус-на некоторых полках (в частности в момент моего посещения)-постельное белье и стиральные …	1
Всё красиво, красочно, шикарные костюмы, трюки, сама постановка, но очень громкая музыка и когда говорит ведущий ничего не понять. Сидели чуть выше середины. Рекомендую	1
Любимое место Новосибирцев и гордость города. Прекрасные спектакли, мирового уровня	1
Новосибирский краеведческий музей – это девять разных музеев в Новосибирске и Новосибирской области. Каждый музей рассказывает свою  историю о прошлом и настоящем Сибири. …	1
Всё нормально а туалеты надо переделывать	0
Новосибирский оперный театр приковывает внимание как пропорционально гармоничным фасадам здания, так и к его со вкусом богатыми интерьерами. Размеры театра впечатляют. Внутри просторные и комфортные парадные и уютные …	1
Не плохой парк в центре города со своими недостатками. Нужно больше бесплатных уборных. Есть аттракционы для детей, есть места чтобы перекусить. В парке чисто и тихо, хорошее место для прогулок. Большой недостаток нету фонтана.	1
Хороший магазин. Но длинные очереди, кассы заставляют долго ждать. Нужно БОЛЬШЕ КПСС САМООБСЛУЖИВАНИЯ! Долгое ожидание на кассе- бич этой ленты	1
Шикарное место. Была последний раз лет 8 назад. Очень много изменений.  Много теплых вальеров и домиков, чтобы можно было зайти и посмотреть на животных. Пингвины, просто ч до, ради них я бы только и ходила в зоопарк. Такие веселые. Ребенок …	1
Восхитительные эмоции после посещения цирка, смеялись "от души" над клоунами, завораживают трюки циркачей и животных. Из минусов: давно пора сделать ремонт всего помещения, не вяжется с городом-миллионником такая убогость, зимой холодно...	1
Замечательный театр! Великолепный репертуар! Актеры прекрасные! Очень чисто, всегда вежливый, интеллигентный персонал. Уютный буфет. Все на высшем уровне.	1
Само здание приятно внутри. Большой зал в общем с удобным расположение кресел. Люстры прям притягивают взгляд. Кафе работает и в общем столики все заняты))) Что касается самой постановки, то... Может я конечно чего-то не понимаю, но 3 …	1
Не очень школа не очень я бы лучши дома ок	0
Новосибирский театр оперы и балета - это одно из самых выдающихся культурных учреждений в городе Новосибирске. Я имел возможность посетить этот театр могу с уверенностью сказать, что он предлагает зрителям превосходное искусство, …	1
28.09.17 Оперировали в 4 хирургии,большое спасибо гинекологам Татьяне Владимировне и Юлии Алексеевне и всему мед.персоналу.Внимательность,профессионализм,все проходит спокойно и без суеты ,в общем как по маслу если можно так сказать.Беседа …	1
Интерьер театра очень лаконичный и приятный, персонал вежлив. Невероятные эмоции от спектакля. Постановка "Карьера Артуро Уи". Продолжительность 3 часа 20 минут с антрактом. Превосходная игра актеров, необычный формат спектакля. Очень понравилось.	1
Отвратительное отношение. 3 января,привезли по скорой,взяли кровь,сделали ренген и выпровадили ночью домой. А на следующий день,по скорой увезли в Краснообск,оказалось ПНЕВМОНИЯ. Вообще, 11 больница,самая отвратительная,по отношению, к людям, начиная от санитарок,заканчивая врачами.	0
Ужасный аэропорт. Грязь. Вонь. В туалетах все не исправно. А только недавно открыли.	0
Стандартный парк в центре города. Деревья, кусты, дорожки. Летом отличный фонтан. Аттракционы (на любителя). Музыкальный театр (театр Музкомедии, но это к парку не относится, хотя и атмосферно). В целом хорошо.	1
Посещали недавно с семьёй, все очень понравилось. Много указателей, кафе. Разнообразие животных, широкие и большие бульвары. Рядом находится дельфинарий и океанариум.	1
Персонал грубоват. Конечно не все сотрудники, но процентов сорок какбудто трудовую повинность отбывают. Главный минус - это туалет. К обеду в это заведение невозможно зайти, поверьте я не придираюсь, буквально невозможно там находиться. …	0
Отличные постановки,но дорогие билеты. В первую очередь пишу про детские спектакли. Важно пересмотреть цены,чтобы больше детей смогли посмотреть спектакли!	0
Очень приятное место для прогулок. Спасибо тем, кто это сделал. Особенно , если учесть, что в Академгородке нет мест, где можно погулять .	1
Большой ассортимент, чисто ,кассиры не всегда приветливые ,работает мало касс ,большие очереди,много молодёжи которая приходит просто посидеть	1
Все сидения потертые, ремонт, отсутствие организованности работ кафе (обещают приготовить заказ за 10 минут, в итоге ждешь час). Зона предрейсового контроля на выходе погрязла в корзинках, о которых легко споткнуться.	0
Больница на троечку Финансирование нет, больница умирает, врачи бегут! Работают фанаты своего дела, которых единицы или кому по разным причинам удобно....	0
Шикарное место как для свиданий, так и для семейного отдыха. Всем реккомендую. В ассортименте утки, ежики, кроты и белочки.	1
Вот всё вроде хорошо,  но не ужели за столько лет нельзя что-то придумать с вентиляцией,  ладно вонь от животных,  но жена алергик и уже из-за этого пункта не может ходить в цирк,  но жара и духота я думаю всех мучает(	0
Была на детском конкурсе в здании цирка. Конкурс очень понравился, но...мрамор советского периода...это конечно ....в здание заходишь и нет понимания, что ты в цирке, кроме специфичного запаха... Как говорят: "Театр начинается с вешалки!" так и тут, зашел и не особо понимаешь...одни мраморные колонны,цветов и то нет...	1
Чисто, не жарко. Только вот при входе всего 2 входа, толпа получается. На выход все двери открывают	1
Впервые в жизни получилось покупать что-то 30 декабря, надеемся что в последний. Попутной оказалась лента на Петухова. Это ужас. Были готовы к большому количеству людей в магазине, но не к грубости кассирши. На ровном месте. Люди злые какие-то стали. И даже праздник не помогает.(	0
Смотрели спектакль Текноника чувств, про потрясающий спектакль, неизглалимые впечатления!!!!!	1
Отличное место для проведения выходных. Приятно видеть, что животные сытые, клетки большие, в клетках чисто. Нет запахов которые отпугивают людей от похода в зоопарк. Территория зоопарк большая,  чисто и красиво. Хорошо, что везде стоят …	1
Елка на катке центрального парка превзошла все ожидания в этом году. Вот такая удивительная красавица. Лёд вокруг тоже ужасен, как и ёлка. Посещать не рекомендую.	0
Невозможно найти парковку!	0
Так понравилась Баядерка, что почти уснула. А сам театр на пятёрку.	1
В музее по разделу истории чувствуется ангажированность либерастической пропагандой. Например, на стенде повествующем о событиях 1930х годов говорилось о том, что цель коллективизации  - согнать крестьян в колхозы без раскрытия смысла зачем …	0
Замечательная атмосфера, сервис, и постановки ! Несмотря на все возмущения и интриги! Балет " Спартак" - это потрясающее действо! Сила и мощь во всем! Декорации, номера , антураж-ничего более грандиозного еще не видела! Всем рекомендую!	1
Спасибо огромное оперативному диспетчеру, которая работала на смене сегодня, 22.12.2023, и водителю 88 маршрута. Сегодня дочь 9 лет ехала одна с тренировки и заснула в автобусе, проехала свою остановку. Диспетчер связалась с водителем и нашли дочку, сделав круг, высадили на нужной остановке. Низкий вам поклон!	1
Один из лучших маркетов города, большой ассортимент, быстрая доставка, и хороший ценник на товары	1
Игра актеров впечатляет! Просто выкладываются. Но сама тема спектакля, на мой взгляд, требует размышления -это соответствует театру?  Я о "Только для женщин"	1
Ремонтируют второй год, развлечения для детей и молодёжи. Много тут гуляют мам с колясками, только вот нет ни одного пандуса, коляску приходится тащить на себе вниз и вверх по многочисленным ступенькам, либо кое как ехать по газонам, …	0
Любимый зоопарк,самый лучший. Все чисто,аккуратно,ухоженные животные,накормленные. Много животных занесено в Красную книгу. …	1
Самый лучший зоопарк! Чисто, красиво, строятся новые просторные вольеры, животные ухоженные! Очень много зелени! Зоопарк постоянно обновляется, построили смотровые площадки.	1
Понравилось кататься на слонике и на машинке. Особо понравился тир, старый тир с пневматическими винтовками. 10 выстрелов стоит 50 рублей.	1
Приятно было пройтись по тропинкам старого доброго центрального парка! Разноцветные огоньки наблюдали за нашими детьми на катке! Имеется прокат инвентаря, что удобно для студентов и школьников близко находящихся учреждений. Время работы катка оптимально также и для работающего населения до 22 часов.	1
Очень стало мило, велодорожки, новые посадки, площадки для детей, новые лавочки. Запах с реки только не свежий. А так по сравнению с 90мы , стало просто прекрасно	1
Мне нравится здесь бывать. Общую атмосферу создают счастливые лица людей после спектакля + волнительное ощущение от прикосновения к чему то неизвестному и соучастия в нём. Очень любопытные переживания.	1
Очень интересный и познавательный музей!	1
Кормят очень вкусно, персонал разный как и везде в общем то.. Но лечение ребёнка толком не объясняют, врача постоянно не найдёшь. Для маленьких детей не предусмотрены кровати, у меня ребёнок не ходит. И в туалет сходит а темболее помыться …	0
Нравится. Но нужно постоянно улучшать зону и углы отдыха. Не хватает ландшафтного дизайна. Заканчивать надо долгострой корпуса при театре. Очень нравится каток зимой. Отличная задумка. Про картонные коробки с развлечениями, говорить не буду. И так понятно. Беспорядок.	1
Не до конца облагородили набережную, и освещения кое- где нет! И ещё, зачем полиция разгоняет уличных музыкантов!? Они никому не мешают или мешают полиции?! Люди создают приятный фон.... На западе очень распространенное явление- уличные …	1
Замечательный театр! По моему мнению лучший в городе. Замечательный актерский состав и великолепные режиссеры, которые способны превратить классику в нечто новое и многогранное, превратить драматический спектакль в чистые эмоции, которые …	1
Мой любимый театр! Люблю здесь бывать. Очень уютное место, все постановки на  пять с плюсом. Хожу в " Красный факел"  давно, стараюсь не пропускать премьеры.	1
Отличный театр. Балет "Копелия" не оставит равнодушными маленьких и больших зрителей. Шикарные декорации, сногсшибательные солисты и балетная труппа. Браво. Будете в Новосибирске, обязательно посетите театр.	1
Даже если вы не особо любите театр - этот театр обязательно стоит посетить. Все таки самый большой оперный в России.	1
Самая лучшая и любимая школа	1
После реставрации и обновления экспозиции музей стал очень классным. Экспонаты обновили. Тем, кто не был вообще, или был до ремонта, стоит сходить.	1
Обязательно к посещению всех! Очень интересно и познавательно. Были с ребёнком, брали экскурсавода. Остались под впечатлением	1
Вы знаете я такой человек что если я иду отдыхать, я отдыхаю и не акцентирую внимание на чем то другом, мне всё понравилось, мы были на представлении Королевского цырка Гии Эрадзе,шоу просто супер, лучше один раз увидеть чем прочесть 1000 …	1
Каждый год мы ходим летом в зоопарк. В этом году особенно понравилось. В самом зоопарке стало гораздо чище и клетки убирают чаще. Запах кое где чувствуется, но в целом больше нет дикой вони от животных, что очень радует и дает возможность …	1
Большой ландшафтный зоопарк. Очень приятно организованное пространство - есть места для отдыха, кафе. Лучшие сувениры продаются не у входа, а возле павильона белых медведей. Единственная проблема - это совершенно лишние, раздражающе шумные аттракционы. Для чего этот лязг, грохот, крики на территории зоопарка?	1
Нормальный парк. Только аттракционы в большинстве своём старые. Колесо обозрения по ощущениям ещё построено во времена советского союза. Развлечений есть, но немного. Территория парка небольшая. Зато в центральной части парка есть мой любимый театр муз комедии.	0
25 мая 2023 года отправляли дочь в Баку. В зоне таможенного контроля мужчина-таможенник ТРИ раза ВРУЧНУЮ (при наличии счетной машинки для денег) пересчитывал валюту ПРИЛЮДНО - ДЕМОНСТРАТИВНО да так, что каждый проходящий пассажир, …	0
Новый аэропорт, красиво, все хорошо. Один большой МИНУС - как и в старом аэропорту - в туалетах грязно, ведра полные, унитазы фууу. Страшно заходить.	1
Чудесно! Даже зимой очень уютно и интересно прогуляться. Дорожки почищены относительно, но всё же	1
