comment	rating
Не ожидала, что это такой большой музей. Очень много залов, грамотно сделаны экспозиции и даже послушали якутску сказку. Не знаю кто это рассказывал, но это был "высший пилотаж"! Харизма, артистизм рассказчицы зашкаливали! Были мы в ночь музеев и я рассчитывала на бесплатный вход, но стоимость 300 рублей...	1
Очень люблю этот театр, красивый и репертуар хороший	1
Ассортимент небольшой, как и сам магазин. Самые низкие цены на овощи. При возможности, конечно, стараюсь посещать гипермаркет на Кирзаводе, там и выбор лучше и свежая и вкусная выпечка.	0
Хорошее место для прогулок, и не только. Здесь можно покататься на велосипеде, роликах, самокате. Посетить аттракционы,прокатиться на колесе обозрения.	1
Хорошее местечко в Академгородке. Найти просто - здесь всегда много машин и людей, и детей. Рядом с прудом есть полка буккроссинга. Если ты один, приходи, корми уток, читай. Для двоих - отличное место для свиданий и поцелуев на мостиках, а …	1
Очень понравилось. Большая территория. Много скамеек для отдыха. Разнообразные точки питания. Небольшой парк аттракционов. И большое разнообразие зверей. Можно прийти на целый день. Есть что посмотреть и чем заняться	1
Очень красиво, чисто. Природа, река и парк, это чудесно)	1
Посетили премьеру оперы "Иоланта". Потрясающе! Прекрасные голоса, отличные костюмы и декорации,  отдельная благодарность постановщику света! Спасибо всем за эмоции!	1
Неплохой музей города. Часто приходят выставки и мероприятия.	1
С советских времён не была в этом цирке... Изменения потрясающие, все здорово! И зрительные места, и фойе и представление! Спасибо!	1
Это большой, точнее огромный магазин. Здесь вы найдете все что душе угодно! От автомобильных шин, до велосипедов! Все для дачи, дома и огорода! Так же конечно большой выбор продуктов питания! Ещё здесь можно купить и еду домой что просто …	1
осмотрен 1 этаж: недурно очень сбалансированная и корректная подача материала чудесная архитектура: из многих залов выход прямо в городской сад	1
Отличное место для отдыха. Можно пройтись и посмотреть на красоту или взять аренду самокат и покататься. Правда на вело дорожке много полоротых детей поэтому лучше не гонять. Ещё можно подняться на колесо и посмотреть на все с высоты птичьего полёта.	1
Театр восхитительный. Ребенку очень понравился спектакль " Высоко". Лично мне не хватило ,зрелищности,что ли...) Король страны шариков в конце, просто сделал весь спектакль,для меня взрослого человека.)	1
Были в музеи, понравилась все, а особенно аудио гид из приложения izi rtaver , подходишь к витрине включаешь, (номер указан) и слушаешь ... как с экскурсоводом, очень удобно...	1
Хорошие дороги, тропинками их точно не назовешь. Аттракционы из-за covid не работают, но на фонтане полно детей, мокрых и счастливых. Вообще очень понравилось что в центре такой крупный зелёный парк.	1
Очень красиво, чисто,уютно, есть и гардеробная и шкафчики для хранения вещей,  приветливый персонал. Можно взять подушки для детей для удобства просмотра представления.	1
Очень красивый театр, потрясающая труппа, вежливый персонал. Обязательно к посещению	1
Не плохой магазин, большой выбор. Масса парковочных мест. Хорошие акции, но минус акций в том что они все идут только по карте " Лента". Стоимость карты 200р., конечно для людей с нормальным достатком вполне приемлемо, но если магазин …	1
Был впервые в данном театре. Все понравилось, спектакль, игра актёров и в целом, очень хорошо провели вечер с девушкой! Обязательно посетим еще раз!	1
Приятное место для единения с природой на небольшое время	1
"Гениальный персонал" требуют документ подтверждающий совершеннолетие, при виде военного билета с фото и всеми отметками твердят что такой документ не подходит, так как даты рождения нет. Ну да у нас сейчас службу же с 14 лет забирают. Гениально...	0
Если бы можно было поставить отрицательную оценку, воспользовалась бы обязательно.Не на все рейсы объявляют посадку. 29.08.23 - человек приехал заранее, прошёл регистрацию на рейс, находился в зоне ожидания …	0
Каждый раз, когда прилетаю в родной город, плачу. Особенно печально стало после начала реконструкции. В последний раз прилетели с отдыха из тёплой страны. Самолёт припарковали с другой стороны от рукава. Сказали, что приедет автобус. В …	0
Если возникнет желание посидеть и отдохнуть, то придётся поискать закуток. Вроде бы просторное помещение, но планировка нигде не обозначена. Совершенно случайно был обнаружен холл в переходе между терминалами: там есть кафе, лавочки и даже памятник лётчикам.	1
Очень все красиво и уютно, но есть только одна дорожка,где можно спуститься с коляской. Нет пандусов,что очень неудобно.	0
Необыкновенная, чудесная, прекрасная программа! Мы в большом восторге от артистов! Были 21.07.2019 года.	1
Очень нравится этот зоопарк! Каждый раз, когда бываю в Новосибирске, даже если проездом, посещаю его. Очень хороший уход за животными, истощённых питомцев здесь не встретишь. И это радует! Обычно, посещая зоопарки, испытываю жалость к …	1
Смотрели премьеру оперы"Сказка про козлика" новосибирского композитора! Яркая,веселая,жизнерадостная! Сыну понравилась	1
Огромный зоопарк с живописной планировкой. Гулять по питляющим зеленым дорожкам приятно и увлекательно. Животные бодры, веселы и хорошо выглядят. Хотелось бы видеть больше карт местности и указателей для простоты ориентации. …	1
Прогулка в парке не впечатлила. В основном, развлечения для детей школьного возраста. Из всего, что понравилось-каток и прокат коньков. Еще привлек внимание киоск уличной еды для веганов. Вот это здорово! Еда, в основном горячие закуски, …	1
В Новосибирске я была в гостях. И очень мне хотелось побывать в музее. Решили, что знакомство с городом надо начинать с Краеведческого музея. Музей понравился. Интересные экспонаты. С экскурсоводом, я думаю, было бы …	1
Центральный парк в последнее время очень нравится. Красивая сцена для выступлений, потрясающий фантан в центре парка. Летом в знойную жару детки с удовольствием там бегают. Есть бесплатная детская площадка. Атракционы   почти все по 200 ₽, …	1
Потрясающий театр! Внутри атмосфера просто завораживающая, в зале сцену хорошо видно с любого места, хороший звук. Отличный репертуар и актеры!	1
Не большой парк. Здесь можно погулять с ребенком, купить шарик, прокатить на машинке и аттракционе. Здесь есть все аттракционы, которые были в парках 80х годов. К сожалению, очень мало точек общепита и просто лавочек для отдыха.	0
Обычная средняя образовательная школа.	0
Всё хорошо, кроме запаха от реки в июле 2021😝 …	1
Почти полгода не была в ЦП. Что новое увидела? Новая сцена и фонтан очень интересный. Советую, сходите посмотрите. Выложено красивой плиткой. Значит, танцевать можно будет без жертвы подошвы туфель. Жаль, что убрали лавочки для зрителей. …	1
Замечательный спектакль "Отцы и сыновья". Очень интересная, оригинальная постановка.	1
Замечательное место! Архитектурно гармоничное, красивое! Были на опере Синяя борода - сама опера - на любителя. На мой взгляд тема не раскрыта в достаточной мере, да и в анонсе говориться, что вопросов оставляет больше, чем ответов. Кроме …	1
Во всем аэропорту не работает половина розеток , зарядить телефон в кафе - 100 рублей.  Детская игровая в зале ожидания -300 рублей за полчаса- не позорились бы , сделали бы бесплатно ! Душно , жарко , цены космические , персонал грубый. Будем впредь стараться "облетать " стороной этот ужасный аэропорт !	0
Посмотрела классическую постановку "Лебединного озера". Впечатления отличные! Здание театра огромное и нарядное. Ковры на полу и чистота! Сотрудники внимательны,милы.	1
С  сетью этих магазинов сложились сложные отношения с самого первого посещения... ценники часто расходятся с теми что в зале и теми что пробиваются на кассе. А вчера заехали купить продуктов , для праздника взяли 2 пирога с мясом отдали …	0
Удобно расположен. Качество программы зависит от гастролеров. И, к сожалению, бывает иногда так себе. Ремонт идёт в зрительном зале. Всё,  и ступени высоченные жуткие, и барьеры все в зрительном зале облицевали чём-то, боюсь ошибиться, …	0
Уютный театр, но очень душно и спектакль не понравился. Ходили на спектакль "Только для женщин". Шокировало, что курили по-настоящему во время спектакля (такая сцена), с такой-то вентиляцией в зале. Вообще не переношу табачный дым, знала …	0
Каждый раз ждём по 5ч в очереди Доктора очень медленно работают Очереди вообще распланированы ужасно	0
Негде спрятатьтся от солнца в жару, но прогуляться можно.	0
Очень классное место, много аттракционов, сцена, где вживую выступают музыканты, есть павильоны с фастфуд. Находится в центре города.	1
Люблю этот театр! Интересные спектакли, красивый интерьер. Из минусов: малое расстояние между сиденьями в рядах.	1
Нам очень понравилось, дети в восторге. Главное попасть в период бодрствования животных, прошлый раз ходили - многие спали по своим пенатам. Зоопарк очень чистый и ухоженный, огромная территория, минимум 2,5 часа закладывать на экскурсию.	1
Большой современный аэропорт. Выполняется множество рейсов. Здание аэропорта большое, внутри есть магазины, кафе. Рядом входом в аэропорт есть остановка общественного транспорта, каждые полчаса до города ходит автобус, стоимость проезда 48 рублей. Также рядом с аэропортом есть автостоянки, отели, постаменты с самолётами.	1
Отличный театр. Побывал на балете "Ромео и Джульетта". Очень понравилось.	1
Ходила с мужем и дочкой на представление с тиграми. Остались все довольны, как взрослые, так и ребёнок! Очень понравилось!!! Билеты конечно не дешёвые, но оно того стоит!	1
Очереди, скотское отношение, вы за свои деньги должны страдать. Пример- две стойки регистрации на рейс из 240 пассажиров. Регулярно зависает компьютер, очередь уплотняется, при этом вещают о социальной дистанции в 1.5 метра	0
До дома едет одна маршрутка. Водители своё расписание не знают. Звонишь в информационгую службу - тоже не знают. По карте реально отслеживаются только 1-2 маршрутки. …	0
Хороший и вполне удобный аэропорт. Жаль вот только стулья убрали из зоны выходов на посадку.	1
Великолепный музей, много экспонатов, можно бесконечно долго ходить и смотреть. Все экскурсоводы хорошо знают материал и приходить на экскурсии крайне интересно. Есть сувенирная лавка.	1
Довольно качественные продукты, без просрочки,  большой выбор продуктов по ценам, хорошие скидки, приятные акции, хорошая работа касс, отличная работа блока готовой продукции, даже в плохую погоду, слякоть всегда чисто. Других продуктовых …	1
побольше бы мест для зарядки телефонов, а в целом аэропорт хороший. удобен в расположении. не хватает правда аэроэкспресса, но автобус удовлетворяет все потребности граждан	1
Отвратительный аэропорт строят не пойми что, сесть некуда с дитём на руках приходится стоять ждать посадки, персонал это отдельная история, хамы ещё те разговаривать не умеют вообще, на входе при проверке заставляют снимать чуть ли не трусы. Хамы одной звезды  жаль	0
Приколдесный колледж, Яков Анатольевич ван лав🤪 …	1
Меняю оценку на кол. Час стояли на паспортный контроль в душной комнатушке два самолёта. Обновление от 18 февраля 2022. Организация нулевая, соблюдение антиковидных мер никакое. …	0
Много развлечений для детей и взрослых, карусели, кафе, прогулка на теплоходе, большое колесо обозрения.	1
Судя по онлайн карте сегодня 23 августа 2019 11:45 на линии всего один троллейбус маршрут 29. Это вообще как на такой длинный маршрут?!	0
Хотела бы поделится своими впечатлениями от шоу "Белые львы Африки": представление оказалось насыщенным, но были номера, где были недочёты, и это я не беру во внимание номера с животными, ведь животные существа непредсказуемые, как дети, с …	1
Маршрут 63 водитель (Кучеренко А, либо Коляда П А), толкнул меня, чтоб я проходила дальше в салон и на повышенных тонах разговаривал с мужчиной рядом со мной. Если ему так не нравится его работа, то пусть сидит дома. …	0
Отличное место, строят новый фонтан, облагораживают! Много развлечений для детей, рекомендую!	1
Отличное место для прогулок и отдыха, особенно преобразился после реконструкции	1
Видел я музеи и поинтереснее... Но для Новосибирска с его небольшой, 100 с хвостиком историей... Неплохо.	1
Небольшой, практически камерный аэропорт со всеми вытекающими плюсами и минусами. Вы без труда найдете стойку регистрации и выход на посадку, однако многие рейсы …	1
Рекомендую для прогулок. Чисто, ухоженно, уток тьма.	1
Хороший парк. Чисто, трава пострижена, везде лавочки, урны. Нет приставучих "зазывал".	1
Зимой конечно особо нечего делать в нашем зоопарке, не работают никакие кафе, поесть негде, половина зверей нет, люди тоже редко встречаются. За то летом, на самом деле кажется что наш зоопарк лучший в России, всё оживает и это становится одним из лучших мест для прогулок и отдыха. Стоимость билета для взрослых 300 рублей.	1
Хорошее место, осенью особенно красиво	1
Мы сегодня с семьей здорово отдыхали.Дочка так обрадовалась увидев разные животные.А животные смотрев на нас тоже 😀. Вовремя карантина так соскучались, давно не виделись. Спасибо организаторам и тем работникам кто ухоживает за животными. Видно что они очень ухоженные, чистые, сытиеи веселые! …	1
Работники доброжелательные. На втором этаже временная выставка с драгоценными камнями, очень красиво. В цоколе и на первом этаже всё "классическое", краеведческое: история, орудия труда и тд	1
Построили новый туалет в зале получения багажа в терминале внутренних авиалиний. Для аэропорта Новосибирска это позор какой-то... короб из гипсокартона, 1 кабинка на всех прилетающих, дверь туалета постоянно открыта, в радиусе 5 метров запах, т.к не успевают проводить уборку. Хотели как лучше, а получилось как всегда	0
Прекрасная опера, великолепная атмосфера музыки , исполнения артистов и энергия зала.. Очень понравилось.	1
Набережная в Новосибирске хорошая. Маленькая, но хорошая. Для прогулок она для меня выглядит несколько странно (ну это скорее что-то личное), а вот для пробежек отличное место. Всё чисто, красиво, довольно ухожено. Не думаю, что есть смысл ехать сюда только для того, чтобы погулять, но гостей свозить точно можно.	1
Каждый раз, когда выпадает снег, в Толмачево немного страшно. Почему-то именно здесь остается ощущение, что выпадает он быстрее, чем убирают, ну и идти от терминала пешком к трапу по ветру и снегу тоже так себе удовольствие. …	0
"Импозантное" здание, яркие, красиво оформленные клумбы. К сожалению, не попали на спектакль, но всё впереди...	1
