comment	rating
Мой отзыв не будет касаться самого спектакля, он был великолепен! Ходили на «поминальную молитву». И так, пришли с женой, она лезет в сумочку и достаёт не те билеты (в другой театр), но так как мы их заказывали на сайте, наши билеты естественно отображаются у администратора на мониторе с указанием всех данных, (ряд, места, дата, фамилия), мы вместе всё это прекрасно видим, но это не помогает, и нам предлагают купить два проходных билета чтоб войти и занять свои же места! И что это единственный вариант попасть в зал. Я был против, но жена не стала спорить и согласилась, до начала спектакля оставалось минуты три. Купили, прошли на свои места, и тут обнаруживаем, что билеты наши (первые), оказывается при нас, ну в суматохе не сразу их нашли, сами знаете что такое женская сумочка 😁 В антракте пошёл снова к администратору, чтоб как то переиграть ситуацию и вернуть напрасно (навязанные) купленные билеты. Ну согласитесь, ситуация простая и понятная, я же не бумажки купил, а услугу, места в конце концов! Зачем мне навязали ещё раз оплатить то, за что я уже заплатил??? Администратор, надо сказать вполне милая женщина, хоть и понимала абсурдность ситуации, помогать не стала, и лишние билеты назад не забрала. Суть наверное даже не в переплате, а в оставшемся  ощущении что тебя культурно развели, разбавили пожиже...🧐 Ну и в завершении отзыва, хочется вслух удивится ценам в буфете: Бутылочка обычной воды 0.5 -100 рублей. 50 гр самого обычного коньяка Арарат- 500 рублей. В Шереметьево наверное дешевле .... Было бы интересно узнать, отчего такая наценка? В чем необходимость продавать воду по цене водки? А спектакль очень понравился! Спасибо всем актерам!	0
Очень красивое здание! Монументальная архитектура! Атмосферное место! Огромное и в Нутри и с наружи!	1
Мне все нравится	1
Ужасное впечатление  у меня сложилось от руководства  цирка. 26 октября  в очередной раз позвонил и меня уверили, что выступление, назначенное на 30 октября состоится. Я покупаю билеты и проезжаю более 1000 километров на мероприятие. Приехав в цирк 30 октября мне говорят , что выступление перенесли на 13 ноября. Приезжайте в эту дату, деньги за билеты не возвращают. А то что я проехал более 1000 км и не смогу приехать 13 ноября никого не волнует. Спустя неделю споров и недопониманий мне вернули деньги без сервисного сбора. И то основной причиной возврата было, что я прописан в другом регионе.  Стыдно вам должно  быть, хотя  если стояла задача заработать  на сервисном сборе, тогда задача выполнена успешно. Тогда верным курсом идёте товарищи!!!	0
Работает круглосуточно. Это огромный плюс!	1
Красивый музей. Реконструкция пошла на пользу.  Приятные интерьеры. Экспозиция стандартная для краеведческого музея.	1
Ассортимент отличный, но ценники и цена на кассе иногда не соответствует. Отказались продавать по цене указанной на ценнике, предложили сделать возврат.	0
Хороший магазин, чисто , много товаров по акции,что приятно радует.	1
Обожаю наш театр оперы и баллета!!! Сейчас он правда называется Новат) Всегда под впечатлением от постановок, шикарное исполнение, волшебная атмосфера, декорации просто ошеломительные, в общем БРАВО👏 Я больше люблю баллет, от которого у меня мурашки бегают и слезы на глазах, но была и на опере Иоланта, безумно красиво и трогательно🙏✨ Сейчас у нас с подругой традиция - раз в месяц посещать театр, это кстати совсем недорого, если брать билеты заранее, но вдохновения и восторга внутри после спектаклей просто не передать словами💛 Приятно прикоснуться к прекрасному и побыть в атмосфере волшебства!	1
Театр оперы и балета - гордость Новосибирска! Он знаменит не только своими великолепными спектаклями, но и архитектурой, которая предает театру торжественность и волшебство. Входя в него, чувствуешь, будто попал в замок из прекрасной книжки, полной чудес! После своей реконструкции театр приобрёл ещё более сказочный вид! Желаю всем побывать в этой сказке!	1
Всегда есть акции на товары	1
Много продуктов на любой вкус	1
Масленица какая-то незабойная, организаторы кислолиции. Драйва напрочь нет.	0
Шалом! Прекраснейшее место подарило нам огромное количество положительных эмоций. Балет оказался открытием для нас. Ходили в компании на "Лебединное озеро". Очень красивый балет, живая музыка. Все было очень динамично и приятно. Главные герои были просто на высоте.  Само здание театра очень роскошное и величественное. Каждый должен посетить это прекрасное место. Очень много людей в зале и коридорах этого прекрасного места. Обязательно приходите сюда и не пожалеете. Однозначно стоит потраченных денег.✌Добра и чести.	1
Красивое историческое здание. Замечательная экспозиция. А когда проводится акция с бесплатным посещением...... это здорово!!!!	1
Решив сделать себе подарок к 14 февраля,посетили с супругом Онегин.Это было ужасно!Ужасная современная постановка,не понравилась игра актеров,вообщем,впечатление от первого посещения Красного факела,думаю,понятно.Так испортить великое произведение,великого поэта А.С.Пушкина,это,конечно,нужно было постараться!Не рекомендую посещение Онегина в такой постановке.Совет всем,кто читает отзыв,лучше тысячу раз подумать...!	0
По карте не дорого	1
Интересно и познавательно.Я в Новосибирске 1 раз и хотелось узнать побольше о городе.Я довольна!	1
Мне нравится отношение к товару, круглосуточная доступность, вкусная выпечка(особенно кукурузный хлеб).	1
Просто здорово, отличное место. Даже если вы пришли сюда не впервые, тут есть что посмотреть, погулять и даже встретить новых знакомых	1
Есть все необходимое круглосуточно	1
В последнее время я, вероятно, не угадываю со спектаклями, потому что мне совсем не по душе ни Гедда Габлер, ни Сильвестр.	0
Сегодня большие очереди	0
Шикарный театр, талантливые артисты , ходили на "Спящую красавицу" все очень понравилось, просто в востооге от выступления👍 …	1
Хочу поделиться своими впечатлениями об этом театре. Давным давно это было, весной 1972 года. Будучи тогда подростком получила в подарок от родителей путевку на двухнедельное путешествие по городам Сибири. На тот момент мы проживали  поселке Малая Сарань Карагандинской области. И путевку дали маме на шахте. Был сформирован целый состав из 12 вагонов. Мы ночами ехали, а днем проводили экскурсии в очередном городе. Так проехали от Караганды до Братска. И были в Новосибирске. Весь день нас водили по достопримечательностям города. А вечером было свободное время. И нам предложили посетить Театр оперы и балета на вечерний спектакль. Мы немного запоздали. Спектакль уже шел. Наши места были на балконе напротив сцены.  Название оперы не помню. Возможно это "Тихий Дон". Почему так решила? По костюмам артистов. Атмосфера меня поразила. Я впервые была в театре, да еще и в оперном. До этого честно скажу, всегда выключала телевизор, если показывали оперу. Но тут было такое действо, что с тех пор вполне нормально стала относится такому искусству как опера. И все благодаря Новосибирскому театру оперы и балета. Благодарю его за это!	1
Цены на неакционный товар - безумные. Акционного товара постоянно нет в этом конкретном гипере. Касс мало открыто - очереди.	0
Прекрасное место! Здесь есть все что нужно в повседневной жизни!!!	1
Отличное место опустошить свой кошелек	1
Пожалуй лучший магазин среди сети аналогичных.	1
Маленький и старый цирк. Очень убогий для города НСК...	0
Раз в месяц как на праздник	1
Сказать - ВЕЛИКОЛЕПИЕ... это не сказать ни чего. Прекрасное здание, от площади до флагштока. Великолепный встречающий персонал, театр начинается с вешалки и тут он начинается шикарно. И конечно постановки: балет, опера... Всё!!!  Это мекка доя любого культурного человека Сибири, РФ, мира...  К посещению Обязательно!!!  Здание театра — крупнейшее в России театральное здание. К 75-летию театра смонтирована подсветка здания. Архитектурное освещение включает в себя 1 426 высокотехнологичных прожекторов с цифровым компьютерным управлением. Новая подсветка театра позволит создавать разные сценарии освещения и световые композиции.	1
Всё круто, но звуки животных в молочном отделе в 2 часа ночи, это очень странно	1
Обновлённый театр не перестаёт удивлять. Его техническое наполнение выходит на международный уровень. Удобные не скрипучие кресла и ноги теперь можно вытянуть удобно. Появились места и подъёмники для маломобильных людей. Не знаю, есть ли какой то закон, определяющий рассаду во времена пандемии, но в кинотеатрах не рассаживают всех в ряд, оставляют по одному месту между группами. А в театре все плотненько сидят.	1
Плюсы: Очень красивый как изнутри так и снаружи. Много мест для фото. Хорошие актеры и представления. Хорошие музыканты и музыка. Прекрасные декорации. Для детей выдают специальные подушки, чтобы лучше было видно. В зале очень темно, ничего не мешает и не светит в глаза. Оркестровая яма во время представления не выделяется и не мешает. Минусы: Приобретать брошюры со сценарием балета можно только за наличные. Еда и вода дорогая и тоже только за наличные. Огромные очереди возле гардероба после представления.(это конечно ожидаемо, но в период короновируса это минус, особенно если учесть, что большая часть людей без масок). Плюсы перевешивают минусы, поэтому 5 звёзд.	1
Замечательно! Была здесь впервые на балете Ромео и Джульетта. Очень красивое здание, прекрасное новое оформление изнутри и снаружи. Все очень красиво и удобно. Балетная труппа просто великолепная, мне очень понравилось. Даже так: я в восторге!	1
Неплохой музей города. Часто приходят выставки и мероприятия.	1
Удобное расположение для путешествующих на Алтай.	0
Интересно, много экспонатов. История и быт как коренных народов Сибири, так и развитие и основание самого Новосибирска.	1
Очень нравиться в последнее время. Прекрасные спектакли, великолепные костюмы, декорации. Исполнительское мастерство выше всяких похвал, после НОВАТа, смогли высидеть только одно действие в Римском оперном театре. Билеты надо покупать заранее мест свободных нет. Беру абонемент на сезон позволяет сберечь деньги.	1
И это центральный парк третьего в РФ города.... Сначала о плюсах: классный фонтан сделали, площадьвылодена плиточкой, хорошая сцена. так же порадовала детская площадка с обилием лавочек..а теперь о минусах... Мало каруселей, минимум развлечений. В районе каруселей 3 лавочки.... Пока дети катаются,не где присесть. Да и вцелом по дорожкам могли бы поставить ещё дополнительно лавочки.  В общем после парка маленького Лазаревского наш парк, это сельский парк, а там городской классный парк.хотя по территории площадь примерно одинакова	0
Очень нравится ваш сеть магазинов очень большой выбор товара больше вам спасибо	1
트립어드바이저 14위 노보 역사 박물관 Краеведческий музей  정말 그 규모가 크던데... 어찌 다른 데 가볼 데가 많아서 들어가보지는 않음. 게다가 상트 에를미따쥐에서 제대로 감상하려고 박물관 방문은 아껴두고 있었음.	1
Много что есть!!!Единственный минус не все ценники соответствуют.	1
Очень плохо!	0
Прекрасное здание, чудесная акустика, изумительные исполнители!)	1
Очень масштабное здание. Внутри все очень красиво  сделано. Много места.	1
Любимый магазин! Есть всё что нужно, всегда все свежее, качественное!	1
Вечная очень на кассе	0
Смутные впечатления. Парковки совсем мало, а так как рядом бизнес центр, то вообще проблемно припарковаться. Нам повезло припарковаться рядом, правда на 3й круг. Фойе, гардероб, буфет - очень приличны. А вот сам зал достаточно потрепан, не мешало бы произвести ремонт. Ходили на "Агентов праздников", спектакль тоже на 3ку. Жене понравилось, я же ушел в смутных чувствах.	0
Гипермаркет Лента действительно довольно средний гипермаркет. Цены там, не существенно, но выше чем в простом супермаркете. Как то на пасху цены на яйца задрали так, что откровенно смешно стало. Порядка 70р десяток стоил.	0
Раньше довольно часто посещали это гипермаркет и всегда оставались довольны. Но в этот раз осталось крайне неприятное впечатление, которое усугубилось за ужином, начну по порядку: во-первых - в отделе готовой продукции весьма удивили …	0
Вчера был на постановке в этом театре. Хочется сказать, что ремонт очень добротный, как и декорации в постановке. Но есть и минусы, нет даже парковки для личных ТС	1
Парк прекрасный! Был, лет 30 назад!	0
Отличный гипер, всё есть. Кассиры достаточно быстро расчитывают	1
Хорошее место, бывал тут в детстве и сейчас почти ничего не изменилось, очень понравилось!	1
Не понятно что творится. Цена не совпадает с действительностью	0
Замечательный неповторимый театр и обстановка в нём. Шикарный спектакль балета "Щелкунчик ", декорации очень красивые, костюмы Замечательные. Сольные партии на высшем уровне, массовка отличная. Масса положительных эмоций и ощущение праздника на длительный срок.	1
Я туда часто хожу	1
Хороший магазин  по низким ценам.	1
Парковка Ленты отлично подходит для дрифта!	1
гуляли в парке решили зайти покушать блинчики, продавец обсчитала нас на 100р и не вернула деньги когда я ей об этом сообщила, была большая очередь, и не было сил скандалить и что то доказывать по этому мы ушли, настроение испорчено было	0
Все отлично но в наше время принимать налом за водичку?!! Идиотизм мягко говоря	0
Очень интересно. Лучший музей, где я была/)	1
Отличная Лента, самый большой выбор продуктов! Достаточ большая проходимость, поэтому все продукты свежие. Великолепный выбор мяса и готового шашлыка, хороший выбор алкогольных напитков и всего остального для хорошего пикника или загородных поездок на природу весёлой компанией!	1
Театр нравится. Артисты старательные ., Хотя немного переигрывают. Пьеса пошлая и примитивная.	0
Наконец-то побывала на "Щелкунчике". Очень давно все советовали сходить. Были с мужем именно на старой постановке, на которой как я понимаю более сказочные декорации и костюмы. Кстати очень красиво! Особенно первая сцена с улицей и сбором гостей. Про музыку говорить не стоит, она бесподобна! А вот полностью от балета я ожидала большего, не знаю может перехвалили и мои ожидания зашкаливали)	1
