comment	rating
Я убеждён - НОВАТ - лучший театр оперы и балета страны! Прекрасные постановки - за несколько дней удалось посмотреть 2 балета П. Чайковского и послушать оперу "Севильский цирюльник" - только убедили в высочайшем профессионализме артистов, музыкантов, всего коллектива театра! Прекрасная акустика, очень красивая внутренняя и внешняя архитектура театра... И, в отличии от Большого и Мариинского, здесь очень доступные цены, потому, постановки могут посмотреть люди со скромным достатком, а это очень важно: высокое искусство должно быть доступным для всех... В общем, НОВАТ - это бриллиант в созвездии лучших учреждений культуры нашей страны! Браво!	1
Гипермаркет Лента радует своим ассортиментом, большинство товары приобретаю по акциям, в молочном отделе в наличии эксклюзивные продукты, широкий ассортимент импортного пива, практически в любой группе найдется товар со скидками, очень актуально иметь карту Лента, в противном случае покупки будут не выгодными	1
Посетила выставку картин Шилова. Дух галереи тот, который нужно. Смотрели фильм о Шилове. Звук был плохой. Приходилось прислушиваться врать я и угадывать... А так понравилось.	1
Полная наебаловка	0
Самая обычная лента. Добавить нечего...	1
В Ленте можно купить все необходимое, цены Вас приятно удивят!	1
Очень не понравилось, что примерно за полчаса до закрытия нас уже начали выгонять из залов. Я понимаю что все хотят уйти домой, но полчаса это достаточно большое время, и поэтому не очень приятно когда и смотрительницы, и охрана ходят вокруг тебя и напоминают что осталось полчаса, 20 минут и так далее. Если уж музей работает до определённого времени, то по идее последние посетители имеют право уходить четко в это время, и не надо ходить им и напоминать что у вас якобы заканчивается рабочий день.	0
Скидка сегодня заканчивается на посуду-50% от цены на полке	1
Достопримечательность Новосибирска. Шикарный театр как внутри , так и снаружи. Большой репертуар. Цены приемлимые	1
Выставки современных фотографов  это на любителя. В остальном всё однотипно как и во всех остальных городах России.	1
Для меня она одна из самых лучших в городе	1
Неожиданно пошлый спектакль "Безумный день Фигаро"	0
Интересный музей, с парковках вокруг только сложно, одни платные	1
После перестановки не могу найти то чай, то ещё что-то. Но в целом всё удобно, особенно после добавления касс самообслуживания. Если у тебя немного продуктов, то сам их быстро посчитал и пошёл, а не стоишь в очереди по сорок минут.	1
Большой выбор. Хороший хлеб там пекут	1
Ну среднестатистический сетевой супермаркет. Бюджетный&средний ценовой сегмент. Все основное, что нужно, есть	0
Народу почти никогда нету, очередей тоже соответственно	1
Магазин норм, НО кассир как то странно посчитал зубную пасту, что в ракет она мне не попала...на следующий день заехал, сказали сам потерял ( не забрал)...неприятно что товар который забывают покупатели исчезает с кассы! Буду внимательнее.	0
Превосходная реставрация залов! Интересные выставки. Но информации по экспозициям порой вообще отсутствует, а стоимость входного билета 300 рэ.	1
Слишком дорогой буфет.	1
Чудесный балет 3D Золушка! Три действия на одном дыхании.	1
Одна из самых лучших лент	1
Раньше интерьер был лучше.  Сама постановка понравилась.	1
Очень понравилось следующее: возможность электронного бронирования и приобретения билетов, хорошая Служба поддержки (предварительно на электронную почту пришло напоминание о спектакле), есть Парковка при предъявлении билета, очень много внимания уделяется безопасности (вход через турникет металлоискатель, досмотр сумок), при гардеробе есть шкафы для смены обуви, очень вежливые и приветливые сотрудники. Сам спектакль, безусловно, очень понравился.	1
Все удобно и понятно	1
Введите дресскод, было обидно видеть в таком месте людей в джинсах и кроссовках.	1
Часто посещаем семьёй этот гипермаркет, находится рядом с домом. Большой ассортимент и низкие цены. Рекомендую.	1
В восторге от самого театра, всё обустроенно на самом высоком уровне! Посетили балет "Лебединое озеро", восхитились исполнением Натальи Ершовой, а также очень понравилось выступление Кайто Хосоя! Думали, что 3 часа с 2 антрактами будут долгими, но все действия смотрелись на одном дыхании, особенно под известную музыку Чайковского, да, оркестр был на высоте!!!	1
Выставка "Шелковый лабиринт"	1
Смотрели премьеру оперы"Сказка про козлика" новосибирского композитора! Яркая,веселая,жизнерадостная! Сыну понравилась	1
Так себе место с так себе акциями😕 …	0
Хорошая экспозиция плюс бесплатный аудиогид-очень познавательно! Хочу посетить всей семьей	1
Очень увлекательно	1
Мне не нравятся их постановки	0
Вполне стоящий магазин, в котором можно приобрести продуктовый пакет первой необходимости .	1
Хорошая торговая сеть. Главно проверять чеки не отходя далеко от касс.	1
СуперЛнта стала обычным магазином.Для выше среднего покупателя	0
Нормальный супермаркет.....если деньги есть!!	1
От души накатались, только система оплаты древняя, карты не принимают, ходили за метров 500 от парка снимать чтобы покататься. билетики как в автобусе и кассиры недовольные!!!	0
23.01.2022 года посетили оперу "Борис Годунов". Отзыв хочу разделить на три части: 1. Новосибирский Театр Оперы и Балета. Это всегда Праздник. Непередаваемая атмосфера. Шикарные интерьеры. Выставка костюмов. Спасибо новосибирцам за то, что сохранили и поддерживаете такую красоту. 2. Хочу отметить персонал театра, начиная от охраны на входе, работников гардероба, сотрудников в холле, везде царит доброжелательность, приветливость, профессионализм, желание и умение решить возникающие у гостей театра вопросы. 3. Собственно постановка. Великолепная игра актёров. Особо хочу отметить актёров, исполняющих арии Ксении, дочери Бориса Годунова, юродивого, странствующих монахов. Как находку постановщиков отмечаю субтитры на экране, позволяющие полностью быть внутри событий на сцене. Спорным, на мой взгляд, решением было использование стилизованных единообразных костюмов, а также почти полное отсутствие декораций. Наверняка, у такого театра, с богатым  почти столетним опытом работы  есть и художники, и швейные мастерские, и декораторы, поэтому приходя в театр, в городе нахождения, на т.с. родной базе, хочется увидеть и красочные декорации и богатые костюмы, к сожалению, этого не было. Возможно, постановка в серых тонах, должна была усилить у зрителя безысходность, тревогу, присущие Смутному времени. В целом, огромная и глубокая благодарность, артистам, персоналу, администрации и всем заметным и незаметным сотрудникам Новосибирского Театра Оперы и Балета за прекрасный Праздник. Браво!	1
Самая лучшая Лента в Новосибирске на Петухова 73.	1
Просто бомба) все можно найти	1
Приятный магазин, на мой взгляд , лучший из Лент	1
Радуют цены на фрукты и овощи	1
Мне она нравится ценами. Много товара нужного. Скидки! Рекомендую!	1
Лента, как Лента. Стандартный гипермаркет, всё можно купить.	1
Не обыкновенно красивые богатые декорации и костюмы балета Спартак. Роскошное здание театра.	0
Это шедеврально, балет "Спящая красавица🔥	1
С удовольствием показала наш музей моему будущему, на тот момент, мужу из Японии. Его впечатлил местный колорит и богатство экспозиции. С любовью из Токио	1
Лента, как лента. Дёшево только по акциям, смотреть можно только красные ценники. По большинству позиций мария ра дешевле.	1
Большой асортимент различных товаров, акции, скидки	1
Отличный музей, всем советую. В учебниках не найдёшь. А здесь х0ть немного можно узнать о наших народа сибири	1
После посещения театра у всех только море позитивных эмоций!!!	1
Историческое здание в Новосибирске, пропитанное особой атмосферой...	1
Заебало всякую хрень в телефон толкаете.а  в ленте все ок	0
О... Ужасное место. Очень, очень все плохо было, когда мы в единственный раз решили сводить детей. Помещение требует даже не реконструкции, а полного сноса и отстройки заново. Страшно находиться внутри. Колонны несущие облезшие и ощущение, что могут рухнуть. Отсутствавала часть сидений в зале. Запах... Ухххх... Ну и на последок бабушки в гардеробе... А нет... Напоследок туалеты с дырками в полу.... В общем все было очень плохо. Даже одной звезды жалко. И да, были давно, года три назад. Но даже если перестоят, ни за что не вернусь. Ибо по цирку видно отношение руководства и сомневаюсь, что что-то поменяется. Дети ушли вообще без единой положительной эмоции, хотя при них старались не обсуждать разруху.	0
Ленты все одинаковые как по ассортименту так и по архитектуре.Почему то товары стали дорожать не соизмеримо инфляции.Особенно разводиловка на колбасах.	0
В Новосибирске Центральный парк крохотный. В новогодние праздники ооочень кромно украшен, в отличие от здания Правительства Новосибирской области. Каток не чистится. Вот так все грустно😔 …	0
Нравиться магазин тем, что большой с тележкой удобно ходить, товара много разного, цены радуют, часто скидки по акции +по карте на кассе.	1
Молодой город и краеведение молодое.омновная экспозиция посвящена периоду СССР	1
Дорого. В Ашане дешевле. В Ленте можно брать недорого только по акции. Единственный плюс- это дешёвое мясо,свинина. Только там берём!	0
Лента находится недалеко от моего дома, мне всегда нравятся ихний акции скидки выбор товаров и все возможные развлечения которые там происходят охранники не дурак ты, кассиршей опрятным, Пашка со мной тоже туда ходил, и все мои друзья тоже ходят туда, и родители,	1
Необходимый, полезный, нормальное обслуживание, большая парковка,  цены на многие товары низкие. А если ещё и по акции - просто замечательно	1
Один из лучших гипермаркетов.	1
не такой захламленный как другие	1
Грамотные экскурсоводы расскажут о каждом экспонате достаточно интересно и познавательно.	1
Ужасно стало дорого	0
Удобно, что работает круглосуточно	1
Нет условий на инвалидов колясочников (((	0
Большое разнообразие товаров, удобная парковка	1
Слабая техника артистов, было стыдно, ушли после 1 акта	0
Не самое лучшее место отдыха.	0
Добрый день	0
И купить продукты можно и перекусить	1
Всё прекрасно, постановка великолепная, танцуют артисты шикарно Минусы- после работы в буфете поесть нечего и санитайзеров практически нет	1
Очень хорошие предновогодние скидки!	1
Малый зал комфортом не наделён ... стулья, сцена...	0
Краеведческий музей - очень красивое и уютное место! Там всегда очень чисто. В нем можно посмотреть предметы из далёкого прошлого. Также можно прочитать о жизни новосибирцев в тогдашнем Ново-Николаевске. Освещение подобрано так, что легко передаётся атмосфера тех лет, что не может не радовать. В Краеведческий музей хочется приехать снова и снова.	1
Всё норм!	1
Сотрудники хамят. Не предупреждают, что с напитками в зал нельзя. Представление понравилось	0
Хорошо	0
Понравилось, советую сходить	1
Сегодня на фонтане в Центральном парке мой сын порезал сильно ступню в нескольких местах! Я не могла проверить, что там за неполадки, но ребенок сказал, что сломаны отверстия откуда струится вода. Возможно порезы об края форсунок, подобная история была в Перми, где поранились много деток. Повреждена ступня с двух сторон и пальчики. Срезы глубокие. Боюсь, мы не последние. Обувайте деток!	0
Просто люблю этот магазин	1
Великолепное мастерство танцоров, сказочные декорации и прекрасный интерьер театра, вот три слагаемых успеха НОВАТ!!!!!!	1
Очень красивый театр! Нереально сказочные постановки, костюмы, декорации!	1
Возникли проблемы с кассой самообслуживания. Пробиваешь товар а система говорит что товар не пробить.	0
Экспозиция бедненькая	0
Отличный театр. Балет "Копелия" не оставит равнодушными маленьких и больших зрителей. Шикарные декорации, сногсшибательные солисты и балетная труппа. Браво. Будете в Новосибирске, обязательно посетите театр.	1
Радует периодическими скидками.	1
Для похода на ночь музеев пойдет, так же для людей которые интересуются историей будет интересно...	1
Магазин хороший,стоянка большая!	1
Большой ассортимент товаров, есть кассы самообслуживания. Продукты свежие, цены приемлемые.	1
Самая удобная из всех Лент.	1
очень хороший музей. в цоколе экспозиция посвященная истории Сибири. первый этаж - история Новосибирска. второй этаж - сменные экспозиции. настоятельно рекомендую посетить	1
Место отличное, магазин просто огонь, особенно если есть их карта, скидки выходят бешеные	1
Цены на товар не соответствуют тем что пробивают на кассе. Памперс премиум 102 штуки указана цена 1200 на кассе пробивается 1999.	0
Нашел всё что искал	0
Место с которого должно начинаться знакомство с городом. Обязательно установить приложение-гид и осматривать музей с ним.	1
Большое преимущество данного маркета- это его режим работы 24/7. Хороший выбор товара .	1
Хороший музей	1
Хороший гипермаркет,часто проводятся различные акции и распродажи.	1
Театр великолепен! Труппа отличная! Каждое посещение - праздник!	1
Мне очень сильно здесь нравится, я здесь был несколько раз и готов приходить сюда снова и снова, я могу вспомнить из увиденного "Щелкунчик", и "Князь Игорь"	1
Удобная парковка. Широкий ассортимент товаров. Постоянные акции, которые реально помогают сэкономить при покупке продуктов.	1
Место супер.есть все	0
Представление прекрасно! Но! Вход один он же и выход и содается толкучка. В гардеробе мало скомеек и он один нереальная толкучка! В зале не подписаны стороны и сектора. Сиденья подписаны только снизу,  если кто то сидит, а симетрии расположения мест нет, то это усложняет поиск. Буфет отвратный. Вспоминаю детство и так грустно и обидно что у моих детей все вот так😯! Чего вам не хватает ? Больше не хочется приходить!	0
Рекомендую.  Были на спектакле "Севильский цирюльник". Всё было прекрасно: атмосфера,  артисты, декорации, музыка... Отличная идея субтитры во время спектакля.	1
Заброшенный парк	0
Музей чистенький просторный. На входе встречают вежливые кассиры.  Цены демократичные	1
Приходите там лучшие скидке подовци и роботники тарговаго зала вам всегда помогут ул ветлушская  Лента	1
Шикарно все. И внешний вид и внутренний. Все сотрудники работают хороши, актеры прекрасны)	1
Роскошный театр! Под впечатлением. Большой, удобный гардероб (театр начинается с вешалки:)),  потрясающий интерьер, выставка костюмов в фойе, удобный, красивый зал. Представление - отдельный восторг, смотрела балет "Ромео и Джульетта". Костюмы, декорации - все шикарно. Персонал превосходный, лучший из всех, что я встречала в театрах. Очень понравилось, жаль, нет возможности регулярно посещать, живу в другом регионе. Всем рекомендую.	1
Как все ленты. Радует знакомость .	1
