comment	rating
Были на спектаклях "Шёпот" И "Радио и Джульетта". Потрясающе. Удивительное сочетание музыки и танца. Артисты так выступали, что в зале от напряжения стояла тишина, и только в конце - буря оваций. Рекомендую очень! Спектакль доступен по Пушкинской, карте	1
Летом ту особенно приятно проводить время. Свежесть фонтана и яркие лучи солнца дают свой неповторимый эффект 😁🙌❤ …	1
Была первый раз. Понравилось очень! Самое замечательное моё путешествие за последнее время.	1
Спец эффекты не очень, но спектакли классные	0
Холодно в зале.	0
Весьма посредственно, если Вы театрал выбирайте другие театры. Если любите Петросяна то Вам зайдёт.	0
Очень красивый, после ремонта. Потрясающий балет! Музыка Чайковского это полный восторг!!! Артисты балета прекрасно исполнили свои партии. Замечательно провели один из вечеров на новогодних праздниках.	1
Очень любим этот необычный не только по форме, но и содержанию театр, а сцена здесь видна прекрасно из любой точки- места  в зале.	1
Спектакль Денискины рассказы...  весело интересно ,хотя в некоторых моментах хотелось бы смешнее.	1
Театр хороший, но для простого смертного не позубам его посещение	0
Люблю "Глобус". Сегодня смотрели "Золушку". Актеры - огромные молодцы! Спасибо за спектакль и вашу игру!	1
Очень плотно забитый зал. Полное отсутствие надлежащей вентиляции и кондиционера. Уровень CO2 зашкаливает - невыносимо после первого акта.	0
Только Путин	0
Шикарный театр. Головокружительный балет Спартак. Эмоции зашкаливают. Это нужно просто видеть и слышать. Замечательный оркестр и артисты балета.	1
Дурдом устроили из продаж на Щелкунчика 👎на сайте тоже невозможно купить! …	0
"Очаг культуры" с парковкой на тротуаре	0
Местечко атмосферное,смотрели спектакль в кафе. Спектакль (Скамейка) понравился, сервис кафе-нет. После окончания спектакля минут 20 ждали,пока официант подойдёт и рассчитает((((	0
Сумашедшие. Кондиционер не работает.дышать нечем,кислорода нет на малой сцене. Вас наказать нужно за это. Насилие над людьми	0
Допого	0
Плохо. Не смогла попасть без одной минуты не могла купить билеты на спектакль. Который сегодня в 19 00.	0
Театр наводит на грустную мысль, совсем не обновляется, ветшает, театр нуждается в ремонте притом в скорейшему, чем быстрее тем лучше иначе грусть и печаль, просто можем его потерять, а так театр очень привлекательный, уютный и репертуар как всегда насыщен и интересен	1
Театр зарабатывает изо всех сил. Ещё не ушли дети с родителями со детского спектакля, а уже приходят зрители на взрослый. Очереди в туалет километровые, народу видимо-невидимо. Пускают в зал за 5-10 минут до спектакля, все фойе в людях, все стоят и ждут.	0
Не,могу,разобраться,в,карте	0
Красивое место. Давно не был в центре, посмотрел на всё по-новому. Жаль, Петровка вся строится и гулять по ней сложно.	0
Историю  театра  принято  вести  с  17 марта 1776  года,  неоднократно  театр перестраивался  и  горел.  Реконструк-  ция  (ГАБТ) 2005 - 2011 года первонача- льно  предполагалось  завершить  в 2008  году. В ходе  реконструкции коли- чество  мест  в  зрительном зале  было уменьшено с 2155 до 1740. В 2013 году в  Большом  театре был установлен но- вый (четвёртый в истории театра) духо- вой орган фирмы "Глаттер-Гец". В июле 2016 года Большой  театр запустил се- рию  уличных  трансляций  своих  спек- таклей. Площадь театра увеличилась в 2  раза - 80 тыс. кв. метров.  В  здании  театра  появилось  17 лифтов и эскала- тор. Сцена, имеющая  объём 6-этажно- го дома, обновлена и компьютеризиро- вана, теперь она состоит из 7 двухуров- невых подъёмно-опускных площадей и может  становиться  горизонтальной,  наклонной  и  ступенчатой.  Под  аван- сценой - место  для  оркестра  на  130  человек. Для  публики  открыты 3 зри-  тельных зала: историческая (основная)  и новая сцена, Бетховенский зал.  Над головой зрителей люстра с 26 000 хру- сталиков, весом 200 кг,  появившаяся в театре в 1863 году и освещающая зал 120 лампами, диаметром 6 и  высотой 9 метров раз в год, опуская вниз, моют электрики.  Лепной рисунок  балконов не повторяется ни на одном из ярусов в  зале. Современный  Большой  театр  включает в себя оперную и балетную труппу, оркестр. Сейчас театр - это 15 этажей: 5 этажей подземных, 7 этажей зрительный зал, фойе и  2 репетицион- ных этажа над зрительном залом. Сю- да  можно прийти  не только  на пред-  ставление, но и на экскурсию.	1
Очень грубый персонал,нахамили прямо на входе, недоброжелательное отношение к туристам.	0
будучи в командировках, была пока что только на 2 постановках _ Спартаке 28 января с Анной Жаровой и на "Ромео и Джульетте" 3 августа с Екатериной Лиховой. Боже, КАК ОНИ ПРЕКРАСНЫ, КАКИЕ  БАЛЕРИНЫ! БРАВО!!! А декорации!!! а костюмы!! восторг по любому пункту! Раньше я думала, что лучше балета Михайловского театра нет! Но НОВАТ показал мировой уровень и подвинул Михайловский в моих предпочтениях.  абсолютно всё в театре прекрасно! Многая лета руководителям, постановщикам, труппе, оркестру, буфету, ВСЕЙ КОМАНДЕ, кто работает в этом театре и вызывает желание еще и еще раз вернуться и приобщиться к ВЕЛИКОМУ искусству!	1
Красивый театр, отличная постановка Аиды. Это место однозначно надо посетить,  если будете в Новосибирске	1
Класс.Все понравилось.	0
Место старинное и очень красивое. Есть парковка, гардероб и буфет. Сама концертная программа понравилась. Я в восторге не только от концерта в нём, а ещё от самой архитектуры. Если у кого-нибудь будет возможность, посетите театр оперы и балета.	1
Театр чудесный! Особенно нравятся мьюзиклы! Браво! Рекомендую сходить на "НЭП"	1
В зале очень душно. В партере, если перед тобой сидит высокий человек или дама с причёской, то за ними ничего не видно. Ещё очень плохая слышимость. Все время приходилось напрягать слух. Очень тесные кресла. Ходила на Инь  и Ян. Белая версия. Не понравилось. Фандорин получился какой то дерганый. И актёрский состав какой то совсем не молодежный(	0
Практически центр города.В пяти минутах ходьбы от транспорта. Симпатичное здание театра.	1
Это лучший оперный театр!!!! Когда я еду в Новосибирск, даже на 1 день, обязательно беру билет, великолепные постановки, все на высочайшем профессиональном уровне, балет, оркестр-выше всяких похвал, обязательно посетите!	1
Цены очень высокие. Жаль отдавать деньги 60-70 т.р за одного человека. Просто не реально.	0
Очень неудобно в партере. Ничего не видно из-за голов.	0
Театриум подчиняется Указу мэра, вход по кодам и паспорту. На входе выставили военных - зелёная форма, китель…. Типа для особо буйных и возмущённых родителей? Позор театру! Пройти такое унижение. Жаль детей, которые любят этот театр, но, извините, поддерживать фашизм и сегрегацию мы не будем.	0
Великолепно выступили артисты, классная 🎤🎼🎹🎶 музыка, восхищена оркестром. Внутренний интерьер поражает своей красотой и гармоничностью. …	1
Замечательный актерский состав, репертуар действительно соответствует названию театра - молодежный. Много спектаклей близких и понятных детям и подросткам. Прекрасно поставленные мюзиклы, да простят меня любители театра музыкальной комедии, но в Глобусе мюзиклы более актуальны и интересны.	1
Просторный, красивый театр. Попали на балет Коппелия , были с дочкой 9 лет. Ей очень понравилось. Когда попросила сравнить Сон в летнюю ночь в Мариинке на исторической сцене и Коппелию в Новат, дочка сказала что и спектакль и театр ей больше понравились в Новосибирске. Вот так, устами младенца....  Также хочу отметить прекрасный оркестр!  Один минус, в антракте в кафе - есть выносные столики в фойе и само основное кафе-зал. Везде очереди, НО у столиков нет предупреждения что не обслуживаются карты, а только наличный расчёт. Так, отстояв очередь, ушли не солоно нахлебавшись - антракт подошёл к концу.  Цены в кафе высокие, вполне московские.	1
Слишком дорого	0
Мне это не понравилось, я там видел	0
Новосибирский театр оперы и балета имеет особую судьбу. Театр, который строился и открылся в период Второй мировой войны, вырос из смелой мысли, силы духа и жажды будущего. Истоки проекта, благодаря которому в итоге появилось самое большое в России театральное здание, находились в головокружительных идеях Всеволода Мейерхольда. В своей беседе с молодыми архитекторами в 1927 году он предложил «произвести революцию в области театрального здания, перепрыгнуть объективные данные современности», взять установку в проектировании на «замечательное будущее, лет на сто вперед». Строительство в начале 1930-х в одноэтажном городе огромного театрального здания было сродни полету на Марс. Инициаторы проекта хотели создать театр панорамно-планетарного типа, «театр техники и реальной обстановки», где перед зрителем могли появляться прямо с улицы автомобили, тракторы, танки или колонны демонстрантов. Непростые реалии зари социализма заставили от многого отказаться и многое изменить. И тем не менее Новосибирский театр оперы и балета всей своей историей доказал: невозможного нет.	1
Была сегодня на опере Князь Игорь. Это феерия музыки, танца, голоса и декораций. Такую шикарную постановку классики пропустить просто преступление. Полный зал апплодировал стоя минут 10,вызывая на поклон и выражая свою глубокую благодарность всей труппе за их труд.	1
Просто волшебно!   Балет "Спартак" бесподобен. Зал шикарный, фойе .. все на высшем уровне. Цены в буфете достаточно дорогие, не для простых людей.	1
Сегодня были на детском спектакле "Мама-кот" очень трогательная история, прекрасная игра актеров. Обязательно смотреть всем. Спасибо режиссеру, актерам. Очень понравилось.	1
Красивый театр хороший спектакль	1
Отличный театр, актёры топ. Единственный минус - в малом зале ещё до спектакля очень темно и чтоб добраться до своих мест нужно постараться не запутаться в паутине проводов. А так же стулья в малом зале весьма убогие. Но зато спектакли хорошие)))00	1
Некоторые места просто непригодны для просмотра балета. Видно только 1/2 сцены, да и то стоя! Стыдно продавать за такие деньги, такие отвратительные места. Нажива и никакого искусства!	0
Очень тесный театр. Запускают в зал минут за 5 до начала спектакля, и до этого момента приходится толпиться с остальными жаждущими культуры в душном и тесном холле, встать некуда, дышать нечем. В женский туалет - бесконечная очередь.	0
Всегда приятные служащие,обстановка ,атмосфера на пять! Спектакль рекомендую- Братишки, Учитель танцев. Молодцы актеры!!! Непередаваемые  эмоции!!!	1
Второй год подряд проходим и ничего интересного. Хоть бы декорации меняли новогодние.	0
Театр это сцена, а ее не всегда хорошо видно.Видимость 40% в театре это смешно.	0
Прекрасные спектакли!	0
Театр не плохой, но режесура отдыхает и актёры, вероятно, вместе с ним.	0
Красивый театр , очень не понравилась парковка на тратуаре перед театром	1
Кто то в восторге от мест, вот наши... за такие места театр должен доплачивать	0
Посмотрел спектакль "Братишки". Очень интересный. Великолепные актёры. Отличная игра. Всё очень понравилось. Спасибо всем, кто принимал участие в постановке спектакля, за суперские эмоции  и отличное настроение😊😊😊👍👍👍 …	1
Большая сцена хоть и выглядит потрёпанной, оставляет самое хорошее впечатление. Актёры на высоте.	1
Мало места, тесно.	0
Когда удаётся сходить на балет, заряд вдохновения получаешь на всю неделю 😊 …	1
Спектакль "13 номер" в репизе просто плохой. Весьма далек от оригинала МХТ. Буфет без крепких напитков, но вообщем весьма неплох. Чудесные бутерброды с креветками, мороженое, кофе. Вот и все	0
Как театр	0
Огромное здание, много гастролирующих и на первый взгляд всегда интересный репертуар	1
Я люблю этот театр! Годы идут, а театр все тот же! Были на спектакле: как стать Снегурочкой . Очень понравился! Такой современный подход к бабе Яге! Супер! Добрый и светлый новогодний спектакль	1
Прекрасный театр! Самый лучший! Начиная от входной двери и заканчивая исключительным репертуаром и волшебными артистами!!! Будто погружаешься в другой мир - культуры, вежливости и красоты. Очень люблю НОВАТ, поэтому про недостатки писать не хочу и не буду. Они хоть и есть, но настолько незначительные, что просто меркнут перед тем прекраным, что дарит театр своему зрителю!	1
У владельцев заведения, законы о правах потребителя координально отличаются от законов Р ф:(	0
Я бы второй раз туда не пошла. Если конечно не долгожданный спектакль, который я могу увидеть только в этом театре. Ему явно не помешает косметический ремонт. Нет уюта, и дело даже не в старом ремонте, просто ощущение что старая квартира, переделанная под театр. Заходя в зал, не смогла отделаться от мысли, что пахнут сиденья. Именно сиденья!! Про спектакль не буду ничего говорить, так как один - не показатель. Может просто не зашёл.. Не с этого города, оцениваю как гость, и как любитель и ценитель театра.	0
Отличный театр	1
Грустно видеть титры над сценой	0
Несколько раз в год ребенок ходит на спектакли , ей очень нравится	1
На новогодних каникулах ходили на сказку щука меля да емеля очень понравилось	1
Ходили на спектакль "КП". Похоже на самодеятельность, но дети иногда смеялись. Наверное я, что-то не понимаю. Театр хороший. Очередь в буфет, цены за пирожки приличные. Попробуем выбрать другой спектакль.	0
Ходили на Робин Гуд! Очень интересно, захватывающий сюжет. А поют просто отлично!	1
Нет сейчас настоящих актёров одна подделка	0
После ремонта НОВАТ выглядит еще лучше. Но цены в буфете... покруче еды в аэропорту! питайтесь искусством, товарищи!	1
Прекрасный театр просто 👍 …	1
Прекрасно встречают гостей, все гостеприимны и вежливы. Дают незабываемые представления, дарят лишь положительные эмоции, актёры полностью отдаются на сцене!	1
Хороший театр! Нравятся постановки и зал уютный	1
Ходили на детскую сказку с ребёнком в малый зал. Очень понравилось, что нет конкретных мест. Дети садятся на мягкие пуфики, подушки, а родители сзади на стульчики. Деткам всё хорошо видно и слышно. Спектакль 30 минут. Дети не устают, кому-то даже мало, хочется ещё)	1
Неудобные кресла, бедноватое фойе.	0
Ни о чес	0
Прекрасный театр, хороший актерский состав, всегда интересные постановки	1
Тут без просто без слов. Сколько уже посетил спектаклей и не вспомню. В восторг прихожу каждый раз, когда нахожусь внутри. Оркестр, выступления, люди - все располагает к отдыху и наслаждению происходящим. Если вы в впервые в Новосибирске - обязательно к посещению. Я уже не говорю про жителей Новосибирка, каждый просто обязан это увидеть.	1
Задержали спектакль на час.	0
Очень душно в зале.Во время спектакля-начинаешь засыпать из-за духоты!	0
