comment	rating
Отличные цены, вежливый персонал	1
Красивые декорации,прекрасные артисты.	1
Как и все Ленты . ПОЙДЕТ	1
Супер магазин, большой, есть кафе, туалет, самообслуживание	1
Ценник на товарах отсутствует часто. Сотрудники в зале ничего не знают. Салаты делать не умеют. В рыбном отделе хамят и желание пропадает там покупать	0
Сегодня посетили театр. Уровень качества обслуживания, свет, музыка... Все на высшем уровне. Очень понравилась атмосфера. Понравилось окружение. Постановка великолепна! Рекомендую всем. Действительно, в наше время так мало отличных впечатлений. Сходите в оперный. Порадуйте себя! Стоит ли водить детей на "Щелкунчик", моя дочь подустала. Нам семь лет. Так что решайте сами. Первая часть достаточно понятна детям. А вторая, уже для нас, для размышлений. Спасибо артистам. Спасибо всем, кто трудится в Новосибирском оперном театре. Рекомендую.	1
Узнали много интересного о Новосибирске. Не очень большой музей. Очень доброжелательный персонал. Лавка с сувенирами обрадовала ассортиментом и ценами. Есть отдел для любителей нумизматики. Достойно.	1
цены завышены на ряд продуктов, а в целом 👍 …	1
Ленту на Петухова гораздо приятнее посещать, чем гипермаркет той же сети на Кирзаводской. В чем преимущества? Здесь гораздо просторнее само помещение, расположение товара гораздо привлекательнее и эстетичнее, в отличие от Ленты на Кирзаводской.  И ассортимент более расширен (по крайней мере это заметно по холодильникам с консервами). И кстати в Ленте на Кирзаводской консервы хранятся не в холодильниках. Жаль, что не все гипермаркеты одной сети хотят быть на более высоком уровне.	1
Много парковочных мест, хороший ассортимент в магазине. Вкусный хлеб кукурузный с сыром и балтийский с сыром.	1
Очень разнообразный ассортимент, вчесть дня рождения скидка 15%.	1
Возможно, здесь есть интересные спектакли и самобытные постановки. Но нам не повезло. Спектакль Странный ужин инспектора .Раффинга не тронулни одной струны души. Сюжетная линия слабая, первый акт мы с подругой откровенно боролись со сном. Перед  вторым актом режиссер добавил оживляж в виде эротического танца служанки на столе с мукой, но это не спало . Закончился спектакль вяло, соседки рядом удивились, что он вот так ни на чем оборвался. . Да, игры актеров я не уловила...	0
Очень здорово придумали кассы самообслуживания на Петухова!👍не нужно стоять в очереди за огромными телегами забитыми до верху,когда у тебя всего три товара)))терминал оплаты принимает как наличный так и безналичный расчет! Молодцы 5. Лента совершенствуется))) …	1
Это замечательный театр оперы и балета, мы больше любим язык танца,  поэтому чаще посещаем балет. Очень огромное впечатление было после посещения балета "Спартак" и "Лебединое озеро ". Хоть раз в жизни нужно посетить это место. Прикоснуться к прекрасному и высокому уровню духовности.	1
Совсем еще недавно здесь был унылый пустырь, а теперь вот Лента. Сам магазин такой же как все остальные ленты. Не лучше и не хуже.	1
Рекомендую!	1
Великолепно Всем рекомендую сходить! Просто не передать словами на сколько все понравилось Начиная от здания театра, заканчивая балетом Шелкунчик	1
Хорошие скидки на продукты питания, хорошее обслуживание.	1
Ну и где лук сивок  время садить а у вас нет	0
Качество обслуживания соответствует качеству	1
будучи в командировках, была пока что только на 2 постановках _ Спартаке 28 января с Анной Жаровой и на "Ромео и Джульетте" 3 августа с Екатериной Лиховой. Боже, КАК ОНИ ПРЕКРАСНЫ, КАКИЕ  БАЛЕРИНЫ! БРАВО!!! А декорации!!! а костюмы!! восторг по любому пункту! Раньше я думала, что лучше балета Михайловского театра нет! Но НОВАТ показал мировой уровень и подвинул Михайловский в моих предпочтениях.  абсолютно всё в театре прекрасно! Многая лета руководителям, постановщикам, труппе, оркестру, буфету, ВСЕЙ КОМАНДЕ, кто работает в этом театре и вызывает желание еще и еще раз вернуться и приобщиться к ВЕЛИКОМУ искусству!	1
Была на выставке Голливудский шик.  Понравилось. Рекомендую.  😍 …	1
Хороший магазин. Правда в час пик очереди большие, так как кассы не все работают.	1
Дорого	0
Очень мало атракционов,  для взрослых вообще нет.	0
Сделали хуже убрали естество знание , поставили история России	0
Мы часто туда ездим, там огромный выбор и хороший скидки	1
Хороший магазин, доступен круглосуточно, удобный	1
Местечко атмосферное,смотрели спектакль в кафе. Спектакль (Скамейка) понравился, сервис кафе-нет. После окончания спектакля минут 20 ждали,пока официант подойдёт и рассчитает((((	0
Прекрасное место г.Новосибирска! Репертуар, актеры - не устают радовать!	1
Отвратительно! Всюду грязь, кривой асфальт, обшарпанные аттракционы, цены на которые, как на настоящие. Лавки с низкосортными китайскими игрушками, да лохотроны - типа киньте дротик в шарик... Короче жесть, очень суровое место отдыха.	0
В принципе дорого	0
Большие изменения произошли в театре. Во-первых, он стал ещё красивее. Появилась выставка театральных костюмов, улучшилось обслуживание в кафе. Во - вторых, это постановки. Интересная хореография и яркие стильные костюмы, шикарное оформление сцены, и, главное, высокий уровень профессиолизма режиссёров и исполнителей. Обязательное место к посещению!	1
Стали поподаться просроченые продукты	0
Цены,просто кошмаром	0
Были на Щелкунчике 15 декабря 2020. Великолепно, величественно, мировой уровень исполнения и настоящее Волшебство	1
Были в гиперленте на Петухова 73 , возник вопрос цены в котором нам с лёгкостью помогла разобраться ведущий оператор Михалькова Елена, за что ей огромное спасибо, очень грамотно и оперативно был решён наш вопрос. Ещё раз огромное спасибо. Очень граммотный специалист, рекомендую!!!	1
Интересный музей с множеством различных экспонатов на тему Сибири, истории Новосибирска,великой отечественной войны и не только.	1
Очень хороший магазин	1
Очень высокие цены, цены не совпадают на касса	0
Всегда когда проездом в Новосибирске заезжаю в эту ленту. Тут есть любой нужный товар	1
Цены стали заметно выше	0
Отличный магазин по скидкам.	1
Очень красивое здание, на грани помпезности. Самое большое театральное здание в России,. С потрясающей историей, о которой можно узнать здесь же. Вежливый персонал, молодые ребята-никаких пыльных бабушек. Отличная акустика. Оркестр  и труппа(смотрела балет), работа режиссёра, художников и балетмейснера - все очень понравилось. Из насущного-в буфете десерты большие, но вкус на "4", туалеты большие и чистые. Пандусов для колясок не заметила, может просто плохо смотрела. Добраться удобно на любом транспорте. Рядом большой выбор кафе, кофеен, пиццерий и тп., поэтому после спектакля есть где посидеть и обсудить впечатления.	1
Современный доступны легко покупки.	1
Всё отлично, на кассах всегда небольшие очереди, цены средние.	1
Интересно очень советую посетить этот музей	1
Отличное место, сходил вместе с Одисеем туда, показал ему нашу главную достопримечательность города. И он пошёл дальше творить добро на канала Аброкадабры. Присоединятесь и вы к нам https://t.me/doge1	1
Доступно. Хорошая парковка. Но цены выше средних за исключением товара со скидкой выше 40%.	0
У нас в городе очень мало исторических зданий, поэтому каждое особенно ценно. Снаружи здание выглядит совсем небольшим, а внутри просторный, высокий, залитый светом зал. Музей стоит посетить просто для осмотра здания, хотя экспозиция и выставки тоже представляют интерес. В цокольном этаже можно оценить качество столетнего кирпича и кирпичной кладки.	1
Доступный не дорогой магазин	1
Познавательно. Но маленький какоц-то музей для города миллионника.	1
Посещаем иногда выставки.	1
Рядом и очень удобно	1
Хороший интересный музей, с неплохой экспозицией. Единственный минус на мой взгляд - это то, что никак в музее не представлена флора и фауна региона	1
Большой плюс магазина - круглосуточная работа.... Хорошая собственная пекарня, рекомендую....	1
Сегодня решили семьёй прокатиться по городу.И,конечно,же первое место куда решили заглянуть был Центральный парк.Сказать,что мы были разочарованы-это не сказать ничего!Мы ожидали уведеть там гуляющих людей,красивую ёлку и фигуры.А там ничего этого и в помине нет!!!!!!Как так?Это же наш Центральный парк!!!И такая пустота!!!Жаль,что так не продумано!!!	0
Работает круглосуточно и большой ассортимент товара!	1
В Ленту всегда приятно ездить. Там чисто, просторно, новое оборудование. Бывают выгодные предложения. Огромный выбор салатов собственного производства. Можно даже порадоваться за жителей Затулинки, что у них под боком такая классная Лента. Сожалею, что ее нет в Академгородке.	1
Дорогой кафетерий, не в каждом ресторане такие цены. Сам театр хороший.	1
Отличный сетевой магазин но цены не радуют глаз даже с картой, очень сильно всё подорожало. Парковка отличная!	1
Народу не особо много. Одна из лучших Лент в городе.	1
Это лучший театр на свете! Это такой кусочек империалистичного Питера - культурное сердце Сибири.	1
Выбор хороший, но большие очереди на кассе, цены могли бы снизить, в более мелких магазинах цены ниже, рвачи короче	0
Хороший музей, советую обязательно сходить	1
Удобное расположение. Часто привлекательные акции.	1
Во первых.. Центр города.. А мошка.. Грызёт как в тайге!!! Вот вторых... Парк стал в сто раз хуже чем был при советах!!!	0
В целом -  обычный областной музей. Сильный этнографический раздел.  Костюмы, быт, оружие народов сибири. На уровне коллекций питерской кунсткамеры. Офигительная временная выставка заподно-европейской гравюры - Рембрант, Дюрер и др.	1
Нормальный маркет если у тебя есть карта	0
К сожалению,  цирк был закрыт. Отсутствовали афиши и вообще какая- либо информация.  На входе висел листок с адресом несуществующего сайта. По-крайней мере, телефон написал "404 ошибка". Очень печально. Хотели с дочкой сходить на представление.	0
Магазин клёвый. Но ходить не люблю. Акции. Понаберешь всякой ерунды. Домой приходишь пять тыщ нет. А ничего и не купил. Затмила реклама глаза .	1
ого класс	1
Просто обалдели хлеб для диабетиков более 300 руб	0
На Масленицу в парке в его две точки по продаже блинов. Везде дикие очереди. Организациия праздника ни какая. Люди пройдя по кругу, увидев очереди, уходят домой.	0
Очень познавательно и увлекательно ,рекомендую всем!	1
Огромный выбор всего	1
Большая парковка, есть автомойка.	1
Приемлимые акции! Отлично!	1
Рядом с домом, большой выбор  товаров, регулярные акции	1
Замечательный магазин,всем советую.	1
Сегодня была впервые на "Шепот радио и Джульетта"- я в полном восторге! Шикарный театр и незабываемая постановка!!!	1
Удобно, попутно, дёшево.	1
Самый лучший супермаркет города	1
Полный обман, если у вас нет скидочной карты, то вас круто надули	0
Внимание, порядочность, профессионализм.	1
Отличный магазин, последнее время покупаем продукты здесь!	1
Ассортимент товаров поражает! Особенно завис возле чай-кофе (присутствовали позиции которых больше нигде не видел). Цены, как показалось, выше чем в привычных для меня крупных магазинах. Хотя детально не сравнивал, а проводить сравнение по 3-5 наименованиям не корректно.	1
Мой самый любимый музей. На это есть несколько важных моментов. Во-первых он расположен в центре города Новосибирск около Первомайского сквера, напротив мэрии и оперного театра. Во-вторых  в нем есть множество исторических артефактов и справочников.	1
Великолепные экспозиции и архитектура . Помещения внутри , это просто дворец какой-то. Особенно колонный зал.	1
Парковка	0
Отличный супермаркет по приемлемым ценам	1
Была на концерте итальянской музыки на малой сцене. Очень красивый театр - от гардероба до сцены! Прекрасные голоса! Восторг!	1
Замечательное место. Лично я получаю там такой заряд положительных эмоций, которого хватает надолго. Сейчас в оперной стал очень хороший оркестр,  играют первоклассно! Получаю эстетическое наслаждение от декораций, всего убранства театра. Солисты прекрасные. Всем рекомендую!	1
Отличный супермаркет выбор сумашедший, но цены порой кусаются, хотя на акционую продукцию если попадаеш можно взять дешевле в половину!	1
Нормальный гипермаркет. Всегда что нибудь нужное можно взять по акции	1
Лента да Лента. Ничего нового и ничего обновлённого. Пришёл купил и все	0
Хороший магазин, все в одном месте и под рукой	1
В театре очень красиво. Постановка, которую довелось посмотреть, очень понравилась. Музыка и исполнение на очень высоком уровне. Один минус- в партере очень небольшой уклон. Из за этого голова впереди сидящего зрителя частично перекрывает обзор сцены. Судя по тому, что впереди сидящие тоже качали головами вслед за перемещениями по сцене основного действа, это мешало не мне одному. Это конструктивный недочет  здания . Просто так его не исправить.	1
Хороший музей, добрые, отзывчивые сотрудники. Жалко, что не хватило времени посмотреть все залы.	1
Нет места для ожидания длиномеров	0
Все хорошо, но бутерброды по 500 рублей, в Домодедово дешевле.	1
На месте парка раньше располагалось кладбище и церковь. Еще до революции были попытки закрыть кладбище ввиду близости к центру города. Еще до революции кладбище было закрыто для новых захоронений, однако старые могилы сохранялись.  Уничтожено было кладбище в 20-е годы. В июле 1923 года горсовет принимает решение об организации на месте кладбища сада. свидетель сноса некрополя А. С. Тростонецкий вспоминал следующее:  Рабочие сворачивают с могил памятники и надгробия, а оркестр наяривает «Марш энтузиастов», заглушаемый криками «Антихристы!» и проклятиями пожилых людей.  Весной 1925 года при обследовании закрытого погоста коммунальные работники отметили на его территории множество разбитых памятников, оградок, сокрушённых крестов и сделали заключение, что для превращения бывшего кладбища в сад потребуются огромные усилия.	0
Нам очень понравился театр. До столичных сцен мы ещё не доехали, поэтому сравнить не с чем. Очень интересное сочетание советской архитектуры с классическим театром. Атмосфера искусства и бархата с красными деревом помогают с головой уйти в сказку, которая происходит на сцене. При наличии билетов можно оставить машину на территории театра. Это очень удобно в современных реалиях.	1
Отлично, все понравилось	1
Большая парковка у магазина. Выбор товаров огромный. Радуют регулярные скидки!	1
Самый великолепный магазин в нашем городе	1
Была почти во всех магазинах этой сети, но Лента на Петухова самая лучшая!!! Отличный магазин!!!	1
Ходили в роскошную заллу театра оперы и балета на севильского цирюльника. Все круто.	1
Большой и чистый магазин. Люблю ходить сюда за покупками	1
