comment	rating
МЕГА! Иначе и не скажешь. Крупнейший театр за Уралом в России, один из самых после Большого и Мариинки (самая большая сцена в РФ). Труппа демонстрирует классический русский балет и очень популярна на гастролях, особенно в Японии. С приходом нового директора и после ремонта театр расцвел, похорошел. Обновились костюмы, декорации и светотехника. Конечно, подорожали и билеты, но настолько ли часто мы ходим в оперА и на балет? Словом, если вы гость города, да и горожанин тоже, очень рекомендую. И не одевайтесь, пожалуйста, в джинсы и свитеры с сапогами и кроссовками. Всё-таки это храм культуры.	1
Очень люблю наш Оперный, после ремонта так вообще загляденье. Хочется фотографировать на каждом углу))). Спектакли все прекрасны, без исключения. Если даже Вы маленьки ребенок - потеряться Вам не дадут очень внимательные служащие, они везде и готовы помочь на каждом шагу!	1
Как-то все средненько, начиная с гардероба (где пришлось выпрашивать плечики для одежды) и заканчивая надуманным содержанием спектакля (Art), неопрятным видом одного из актеров, затхлым запахом в зале.	0
Ходили дважды на балет. Шикарно здесь всё. Начиная с самого здания, (неудивительно, что это одна из главных достопримечательностей города), продолжая интерьером ( очень красиво, а сам зал изумителен), заканчивая балетом. Костюмы и актеры на высоте. Обязательно придем еще, если будем в Новосибирске.	1
Были в Новом зале. На детском спектакле.  Играли на уровне, но спектакль очень мудреный для детей. Намешаный из 3-4 сказок.  Сам зал и места для зрителей позорный для Большого.	0
Весьма интересно	1
Потрясающий театр. Были на Волшебной лампе Алладина. Ребенок (6лет) в восторге, мы тем более:) Разносторонний репертуар, много мест на соседних улицах для парковки. Буфет традиционно дорогой, но можно взять с собой всегда. Также понравилась возможность сделать фотографии с героями спектакля. Всего 300 р.	1
Мне	0
Не соответствует своей помпезности.	0
Там было очень круто, но после ремонта стало очень плохо.	0
Цены дорогие. Спектакль отличный	1
Уютный малый зал, в большом пока не удалось побывать)  Душевные, живые спектакли, во всяком случае из того, что мне удалось посмотреть.	1
Позор системе большого театра! Онлайн билеты не купить вообще, с выбором мест на щелкунчика что-то странное происходит, постоянно меняются якобы доступные места и их невозможно нажать. Вы только с перекупщиками работаете 🤦‍♀️ Не все в Москве живут и могут живую очередь отстоять, кто-то даже из другой страны приехать хочет, чтобы щелкунчика посмотреть, увы, это никогда не было возможно	0
"Все оплачено" скучный, нудный спектакль с хорошими актерами	0
1. Я видел оперу в главном театре, но английских субтитров не было. Расстраивает то, что появляются только русские субтитры. Приятно посмотреть оперное представление. 2. Неудобно пить во время перерыва. Мне показалось странным, что очереди нет, но, кажется, на то была причина.	0
Прекрасное место, понравилась работа оркестра и актеры молодцы, неожиданно увидел титры на опере. Приятно но не удобно смотреть на них вверх.	1
Камерный театр "13трамвай" постановка французского режисеоа "Бал". Взгляд на историю России через призму танцев. Обязательно для посещения. Шикарная пластика, потрясающая игра актеров, смена образов и костюмов поражает своей скоростью и при этом реплик практически нет, только движения музыка и эмоции. Рекомендую к обязательному посещению.	1
Ходили в этот театр на спектакль "Love Letters". Спектакль понравился. Театр - категорически нет. Пришли, как всегда, заблаговременно, за 45 минут, в 19:15. Раздеться нельзя, поскольку как раз в это время закончился какой-то детский спектакль. Шум-гам, крик, дети одеваются. Наконец, разделись. В зал не пускают, видимо надо было его убрать после детей. А зрители-то прибывают. Сесть нЕгде, да что там сесть, стоять уже нЕгде, духота, толпа уплотняется и уплотняется. В зал запустили в 20-08. Форменное издевательство. Первый раз такое... Больше я в этот театр, где так издеваются над зрителем, не пойду. И другим не советую...	0
Непритязательный интерьер, не молодая сцена. Но это же не главное, правда? Главное великолепные постановки, а их у 🎭 достаточно! …	1
Были на спектакле АЛЫЕ ПАРУСА. Очень рекомендую. Но ценз.... Я бы сказала 16+	1
Театр оперы и балета - гордость Новосибирска! Он знаменит не только своими великолепными спектаклями, но и архитектурой, которая предает театру торжественность и волшебство. Входя в него, чувствуешь, будто попал в замок из прекрасной книжки, полной чудес! После своей реконструкции театр приобрёл ещё более сказочный вид! Желаю всем побывать в этой сказке!	1
Мало кабинок в женских туалетах, вечные очереди. Напитки и закуски по космическим ценам, цена билетов, считаю, тоже завышена. В общем, театр с претензиями.. Но сам пока не соответствует тому уровню, к которому, видимо, стремится. Зато танцоры порадовали. Чудеса, красота и грация на сцене. Спасибо.	0
с удовольствием посетила театр. спектакль "лес" очень понравился.	1
Хороший театр	1
Ходили на спектакль Серебрянное копытцо,остались довольны, в спектакле играло много детей,все хорошо выступили,Молодцы!	1
Лично я влюблена в этот театр. Меня всегда потресало это архетектурное сооружение. Все постановки,  которые я посещала безусловно нравились. Звучание классической музыки, игра артистов - Всё это потрясает меня !!! Очень люблю оперный театр 💝!!! …	1
Мне очень сильно здесь нравится, я здесь был несколько раз и готов приходить сюда снова и снова, я могу вспомнить из увиденного "Щелкунчик", и "Князь Игорь"	1
Посетили прекрасный концерт в Оперном театре. Тема - вальс. Ушли под большим впечатлением! Представление понравилось очень! Впервые мы увидели, что дирежер общается со зрительным залом, комментируя и представляя произведения. Это необычный и очень правильный ход, потому что слушать музыку, зная историю её создания ещё интереснее! Очень вежливый персонал! "Театр начинается с вешалки", и в этом театре эта истина полностью реализована! Большое спасибо за доставленное удовольствие от пребывания в этом Храме искусства!	1
Кому нужны мои впечатления о Новосибирском оперном театре? И так очевидно и сто раз доказано: лучший классический музыкальный театр за Уралом. Кстати - при всех минусах г-на Кехмана (очевидно непорядочный человек) при нем театр получил денежные вливания и, сколько бы при этом не было украдено (это вопрос к правоозранителям), театр стал гораздо наряднее: интерьер преобразился в лучшую сторону, сама атмосфера в театре стала праздничной. Молодцы. Про художественную ценность постановок (особенно оперных) можно спорить до бесконечности, я приверженец классического подхода и мне не нравится то, что сейчас происходит, но в целом театр последние годы "встрепенулся". П.С.: травлю Кулябина не прощу.	1
Ужасное место	0
Совдеп	0
Балет Щелкунчик был со слабой хореографией, несинхронно, с падениями и артистами в плохой физической форме. Впрочем, не все. Сценография хромала особенно. От сказки почти ничего не осталось - не выражены сюжетные переходы, размазана кульминация. Было похоже на первую репетицию.	0
Фестиваль Знаки, классное мероприятия, костюмы у ребят бомба!!	1
Так себе  зал, навигация отсутствует, уставшые работники, высокомерный старший персонал. Не хочу сюда ходить, и никому не советую. Омерзительное впечатление осталось , была два раза, в надежде , что первый раз было случайность,ан нет. Ребята , идите в другие места, не ждите здесь чуда. 👎👎👎👎👎👎👎👎 …	0
Очень маленький зал,однако система кондиционирования либо совсем не предусмотрена для неприхотливой публики с левого берега..... Впрочем,как и сам спектакль на уровне Дома Культуры где нибудь в сельской местности....	0
Я в шоке от посещения театра. Где паркет? Откуда этот колхозный ковролин??? Смотрела Щелкунчика, впервые в жизни не понравилось, декорации очень бедные, их фактически нет, костюмы просто ужасны, да, музыку не испортить, оркестр был на высоте, как впрочем и артисты балета, исполняли партии великолепно, а вот антураж🤦‍♀️. А ведь балет воспринимается прежде всего глазами. Позор руководству города и области, до чего позволили довести гордость нашего города!	1
Великолепная труппа, шикарные постановки, маленький душный холл, очередищи в туалет и гардероб, хамовитый обслуживающий персонал. Вывод: худрука премировать, директора по АХО разжаловать в билетёры. Итого: 5 за постановки, 2 за инфраструктуру, средняя – 3 с дохленькой половинкой.	0
Потрясающий мюзикл Алые паруса, в восторге даже дети	1
Они поливают друг друга моей с кислотой	0
Великолепно Всем рекомендую сходить! Просто не передать словами на сколько все понравилось Начиная от здания театра, заканчивая балетом Шелкунчик	1
Находится далеко от метро, зал так себе	0
Внутри не был, снаружи красиво.	1
Хорошие,интересные спектакли для детей и взрослых.Красивые декорации т костюмы артистов.	0
Прекрасно и величественно. Высоко профессиональный оркестр, труппа достойна столичной сцены. Браво.	1
Спасибо за спектакль	1
Спектакль  " Братишки" супер, игра актёров бесподобна👏👏👏 сходим ещё  не один раз!!! …	1
Красивое место, бар и еда дорогие. Билеты тоже, считаю, дороговаты. Парковка небольшая. Были там на опере "Борис Годунов" Цена на балет "Спартак" была не сильно ниже, чем на этот же балет, но в Питере в Михайловском театре (и не пожалела о выборе) Лавочки на аллее перед входом в жаркую погоду выделяют смолу!!! Никаких предупреждающих табличек. Порча одежды обеспечена.	0
Отличный театр. Только положительные эмоции. Потрясающие выступления. Советую всем посетить.	1
Яркие красочные спектакли! Очень динамичные -поэтому детям любого возраста легко смотреть от начала до конца. Современный театральный интерьер . Постановки всегда макимально приближены к оригиналу. Классический театр, прививающий ребенку представление о культуре!	1
Музыки много комедии мало один из четырех спектаклей это тетушка Чарли понравился	0
Ну видел я ваш большой театр. Не такой он и большой.	0
Сам спектакль понравился. В туалете вонища была, крайне не приятно (вроде и людей не много, проходимость не большая, но...).	0
Театр интересно оформлен, уютный зал с хорошими креслами и кондиционером. Парковаться можно на соседних улицах. Не понравились очереди в туалет. Спектакль в целом понравился.	0
Репертуар хороший, сотрудники вежливые. Само здание театра не очень удобное, в буфете маленький выбор, безналичная оплата только в одной кассе буфета, в зале жарко.	0
Новат решил устроить МХАТ! Где опера? Уже не только балет шпарят, но и говорильню запускают. Ждём лучшее время. Эта сцена ещё увидит настоящую оперу.	0
Посмотрели балет Золушка. Очень понравилось красиво, интересно, не ожидал что так можно показать сказку. Сам театр с мраморной лестницей и большими фойе впечатлил.	1
Будете в Новосибирске обязательно посетите данный театр. Возможна покупка билетов в интернете. Распечатка при входе не требуется. Достаточно QR-кода на телефоне.Рекомендую.	1
Очень специфический театр. Наверное понравится людям , желающим тесного контакта с артистами. Первый ряд партера-все запахи, брызги и визги -ваши!	0
Спектакль "Золушка", рассчитанный на самых маленьких, заставил растрогаться даже взрослых. С удовольствием хожу сюда на все постановки. Жаль, конечно, что так мало внимания удаляется ремонту внутри - все обшарпано, везде сколы, в туалете всегда неприятный запах и отсутствует туалетная бумага - это неприемлемо в цивилизованном обществе. И о замене спектакля нужно сообщать заранее, на мой взгляд. (неприятный случай со спектаклем "Игрок") А в целом молодцы, особенно актеры, выкладываются по полной перед публикой.	1
Парковок нет, пафос, буфет дороже ресторана. Балет для реальных ценителей, простому обывателю не понять. Часто машины эвакуируют	0
Достопримечательность Новосибирска. Шикарный театр как внутри , так и снаружи. Большой репертуар. Цены приемлимые	1
Хорошо проведенное время. Превосходные спектакли. Хорошо подобранные артисты. Прекрасная игра. Большая парковка	1
Впечатление негативное спектакль леди Макбет мцерского уезда поставлен отвратительно  сцена видна только из партера первых рядов театр весь обшарпанный на люстра не горят некоторые лампы, что сразу бросается в глаза роспись потолка напоминает китайский ширпотреб. В целом полное несоответствие заявленным возможностям и реальной действительности в театре. Возникает чувство диссонанса разочарования перерастающее в раздражение учитывая стоимость.	0
Отличный театр, красиво, уютно, везде аккуратно и чисто.	1
Один из старейших театров Новосибирска. Красивый и уютный. В репертуаре драматические спектакли на любой вкус.	1
Выгоняют по окончен ю спектаклей.даже не дали сходить в музей кукол	0
Рекомендую.  Были на спектакле "Севильский цирюльник". Всё было прекрасно: атмосфера,  артисты, декорации, музыка... Отличная идея субтитры во время спектакля.	1
Сам театр мне давно нравится, а в этот раз  на Летних балетных сезонах было интересно оказаться в ложе у сцены. Билеты продавались обычным образом и по цене партера, поэтому решили попробовать. Правую часть сцены, конечно, не видно, но в остальном очень понравилось.	1
Ребенка первый раз сводила на оперу. Ребенок в восторге и от самого театра и от спектакля. В эти выходные идем повторно на оперу "Кот в сапогах". В театре очень красивый интерьер, а еще хочу отметить очень внимательных и доброжелательных сотрудников театра!	1
Театр юных зрителей.ТЮЗ Глобус.еще в детстве ходила сюда с родителями и со школой)Хорошо и уютно здесь	1
Несут заказы долги , а так норм	0
