comment	rating
Качественное представление, масштабные сцены, хороший звук, профессиональные исполнители. Отличные декорации. Все на высоком уровне. Здание величественное. Зал и сцена огромные. PS: К бутербродам по 300 рублей не был морально готов. Не успел поужинать перед оперой, отдал в буфете 1000 рублей, даже не почувствовал что что-то съел.	1
Нарушают закон. Намеренно калечат сотрудников.	0
Посмотрела классическую постановку "Лебединного озера". Впечатления отличные! Здание театра огромное и нарядное. Ковры на полу и чистота! Сотрудники внимательны,милы.	1
Очень красивое место для посещения. Самый красивый балет! Самые лучшие эмоции именно здесь!	1
Магазин большой, а по этому, есть ВСЁ!	1
Я разочаровалась в Ленте! Раньше часто заезжали, потом несколько лет не была, и решила снова возобновить практику поездок сюда - но не судьба! Цены выше чем в магазинах возле дома! Попадаются выходные предложения, но все остальные купленные продукты эту выгоду перечеркивают!	0
Очень нравится этот магазин. Что-то  есть именно там, и по низким ценам в сравнении с другими магазинами.	1
Как будто бы в моём доме сделали помпезный евроремонт. А меня не спросили, хочу ли я этого.	0
Театр очень понравился, в фойе правда один сплошной буфет и безналичного расчёта там нет, так что если хотите сходить в театр и там скушать бутерброд с красной икрой за 500 рублей, то запасайтесь наличными деньгами.	1
За постановку 5, за дешёвый коньяк стоимостью 500 рублей за 50 грамм - минус 3 звёзды... Это какой то бред(( с такими ценами в буфете театра даже хороший ресторан тихо стоит в сторонке....	0
Лучшее место отдыха в Новосибирске!	1
Отличный магазин продаются практически всё	1
Лента стала дороговатым гипермаркетом. Выручают и радуют только скидки.	0
Да, я действительно бываю часто здесь, ну нравится мне ЛЕНТА	1
Оооо очень плохооое место никогда низа что неее заходите сюююдддаааа	0
Красивый театр, отличная постановка Аиды. Это место однозначно надо посетить,  если будете в Новосибирске	1
Мало экспонатов	0
Один из красивейших театров Российской Федерации. Недавно он был отреставрирован. Завораживает величие и размах его интерьера. Только непонятно почему в куполообразном потолке сквозь роспис зияет щель. Это так задумано?	1
Сиденья деревянные !!! 2 часа смотреть цирк это ад!!!	0
Театр великолепен, весь интерьер создаёт праздничное настроение, давали Щелкунчика, спектакль отличный, интересная постановка, восхитительные декорации. Прекрасная рождественская сказка. Рекомендую.	1
Работники доброжелательные. На втором этаже временная выставка с драгоценными камнями, очень красиво. В цоколе и на первом этаже всё "классическое", краеведческое: история, орудия труда и тд	1
Отличный магазин из всех и из всех Лент в Новосибирске.	1
После ремонта стало хуже. Верните старый добрый Оперный!	0
Хороший музей. Цены только подняли.	1
Произвел хорошее впечатление	1
Хорошо	0
Неплохой музей, внизу раскалывается про историю коренных народов Сибири, вверху — по историю Новосибирска после колонизации.	1
Конечно, наш театр красив! Была после ремонта первый раз на балете "Лебединое озеро"- все прекрасно: декорации, костюмы, артисты. Музыка - вечная классика. Но! На входе никто не мерил температуру и при посадке все места заняты, а не через одного. Наверное, так разрешили. Люди, конечно, не стремились соблюдать меры безопасности, хотя постоянно работники театра напоминали о необходимости быть в маске.	1
Посмотрели выставку "Голливудский шик", " Свистульки". Ходили втроем подружками, повеселились от души, как подростки. Красивые залы с высоченными потолками, лепнина, паркет, шторы. Милейшие смотрительницы с хорошим чувством юмора, заботливые и внимательные. Тишина и неспешность  в самом центре города. Спасибо за островок покоя и знаний! Обязательно придем ещё!	1
Очень хороший супермаркет, много товаров по акции, дополнительные скидки если расчитываешься через приложение	1
Что как то не очень ,зашёл вроде бы все как везде.но проходишь дальше тавара валам стоит бардак фрукты ,оващи не охти выглядят.канешь по мне испортилась лента.один плюс 24 часа.работает	0
Ходили на Лебединое озеро. Три часа пролетело как мгновенье! Красиво, захватывающе! Восторг и восхищение! Живой оркестр чего стоит!	1
Ужас. Ни цен, ни качества. Магаз у дома лучше и дешевле.	0
Сам оперный театр действительно прекрасен, как и спектакли.	1
Весьма странное "заведение". Гуляли рядом, подошли иностранные гости и попросили показать, где вход, как купить билеты и что сегодня идёт, т.к. сами по русски вообще не разговаривают. Говорим, окей, сейчас всё вам покажем и расскажем. Подходим к зданию, двери закрыты, написано кассы и там закрыто, звоним по телефону, не доступно. Ни объявлений, ни информации, непонятно ничего. И тут перед гостями стало очень и очень стыдно, прям неприятно. Да и сказать им нечего даже было ибо сами находились в недоумении.	0
Хороший супермаркет есть все что нужно, можно  перекусить, большая парковка	1
7 ноября смотрела  балет "Ромео и Джульетта". Я в полном восторге. Прекрасная постановка, замечательное исполнение, чудесные декорации. Получилось отличное завершение ноябрьских выходных!	1
Продавцы затупки, все дорого. Охранники как бараны стоят	0
Для краеведческого музея очень не плохо, много интересных экспонатов.	1
Великолепно!!! Понравилось 👍🏻 Прекрасный интерьер фойе, чистота, свежесть! Зал - не описать, как красив! Артисты - приезжие звезды Михайловского театра! Костюмы, декорации, массовка просто огромная! Зрителей - полный зал!!! Кучи цветов после занавеса!!! Рекомендую!	1
Мало работает касс. Очереди. Кассы самообслуживания работают не все, тоже очереди.	0
Простой человеческий диалог с гидом Семейный билет на 3х человек 300 рублей	1
Лучший культурный досуг города. К счастью или к сожалению. После ремонта оперный преобразился. Стулья по-прежнему неудобные, да, но в партере сидеть стало лучше. Теперь это не темница в подвале, а театр. Можно спокойно раздеться, оставить вещи в бесплатных ящиках (!!!) и пройти по электронному билету. И до нас докатилось	1
Нормально	0
Неплохой музей. Старой школы. Много интересных экспонатов.	1
Некоторые сотрудники не вежливы	0
Бабульки музейные сидят спят ,ничего не знают... Сам музей понравился.	1
Очень радует, что есть кассы самообслуживания!	1
Всегда с удовольствием посещаю выставки музея. Они уникальны. Одна из последних выставок,которую я посетила, посвящена ситцу. Очень красивые экспонаты.	1
Суперский магазин!!! Ещё бы касс открытых по больше делали, а то постоянно очереди с таким огромным количеством нерабочих касс	1
Потрясающий театр, ничем не уступает столичным. Просторные хохлы, нарядная публика. Отличная акустика. Смотрели балет Спящая красавица💤👸. Прекрасная постановка! …	1
Интересные исторические факты из жизни и быта людей можно узнать в музее	1
Обычный музей. Ходили пасхальные яйца смотреть, мне не хватило описаний. Интересные  работы по керамике.	1
Театр до ремонта был более уютным и доступным. Сейчас много ковров, роскоши..., но цены... зачем закрыли 3 ярус? Балет оттуда смотрелся великолепно	1
Интересные коллекции, выставки. Очень душевный персонал. И более, чем бюджетно	1
Отличная сеть магазинов.	1
Спектакль очень не понравился.( Я. Другой. Такой. Страны) Решили ходить только по рекомендации.	0
Отличный театр. Побывал на балете "Ромео и Джульетта". Очень понравилось.	1
На кассе такая &&& женщина стоит , что все желание отбивает на посещение	0
Мне нравится наш музей. И постоянная экспозиция интересная и "приезжие" выставки радуют.	1
Прикольный магазин не дорого там	1
Был впервые	1
Всё супер	1
В Бердске мне он не понравился как-то не до Лента	0
Отличное место. Рекомендую.	1
Очередь	0
Большие очереди на кассах, половина касс не работает	0
Отличный магазин, вежливый персонал, все есть, всем рекомендую. Мой любимый магазин!!!	1
Мне здесь не очень понравилось. Огромные наполовину пустые залы. Я ожидала от Краеведческого музея большего!  Больше и интереснее выставок с экспонатами. Этому музею далеко до Красноярского Краеведческого музея. Персонал приветлив и вежлив. В сувенирной лавке и то интереснее. Не пойму, почему новосибирские музеи цепляются за Алтай?  Этому городу больше 120 лет, есть своя история, вот и рассказывайте про нее, а не про шаманов, которые жили на Алтае. Они с Алтая, а мы в Сибири, в Новосибирске!	0
На мой взгляд, слишком мало действительно древних экспонатов. Большинство из представленных экспонатов датируются концом 19 - началом 20 века.	1
Спектакль есть один там "Сильвестр", не понравился. Сам театр по себе не очень, вообщем 3	0
Интересное место. Хоть и центр города, но внутри очень тихо и спокойно. Понравится тем, кому интересна история.	1
Хороший магазин,все есть	1
Возрастные продавцы, медленно обслуживают, очереди на кассах.	0
Очередей почти нет, большой ассортимент,есть  на полке 1 пачка Легендарного арахиса Цзиньхуа.	1
Странное переименование Нашего Оперного в непонятное слово НОВАТ вызывает у меня отторжение, равно и как новый худрук (бывший директор). Сам театр, конечно,  красив и величественен. Цены на билеты вполне доступны, хотя, конечно, не на каждый день. И это правильно. Поход в театр должен быть праздником, а не повседневным мероприятием. Но вот буфетные цены!- это перебор!	1
Музыка Щелкунчика под управлением Эльдара Нагиева была волшебной! Интерьеры, новогодние ёлки, сказка и восторг, праздник!	1
Интересное место. Хоть и центр города, но внутри очень тихо и спокойно. Понравится тем, кому интересна история.	1
Цены радуют , но когда взвешиваешь на весах лежит подложка которая добовляет нраммов ну и цену понятно	0
Большой, красивый музей с разными экспонатами, очень впечатляет!	1
Просто супер.! Идеальное место для саморазвития.	1
Утром большие очереди в кассы.	0
Балет Спартак мне очень понравился. Оценка 5 игра кардеболета. Цена на еду супер завышена. Но в театр оперы и балета не за едой идут.	1
Отличное здание с очень советскими статуэтками спереди.	1
Ужасное состояние аттракционов. Страшно ребенка садить	0
Обслуживание и расстановка товаров на уровне таких маркеров как Светофор или Маяк, но цены завышены, не соответствуют качеству и обслуживанию	0
Балерины несколько раз падали, буфет дорогой. За оркестр, костюмы и общее впечатление плюс	1
В Ленте скупаемся регулярно, всё устраивает- это наш любимый магазин.	1
Удобно, все в одном месте, всегда пользуюсь этим магазином!!!	1
Невзирая на недавний ремонт былая нищета иногда пробивается наружу.	0
Мой муж любит Ленту. Ему нравится что там быстро обслуживают. Долго в очереди не стоять. А я люблю Ленту за салатики))	1
Огромный выбор товаров на любой вкус и цвет	1
Мне нравится) Отличный магазин с приветливыми ценами)	1
Очень уютный и чистый сквер. Тенистые аллеи и величественная архитектура оперного театра. Очень понравилось это место. Жаль, не удалось побывать внутри, и посмотреть всё убранство здания. Обязательно посещу вновь, когда буду в Новосибирске вновь!	1
Рано или поздно, но все люди должны задуматься о духовном :) В такие моменты рекомендую посетить Новосибирский краеведческий музей. Сам жил тут 15 лет и ни разу не был, сводил туда ребенка недавно и был очень  впечатлён.	1
Хороший магазин, кассиры быстро работают. А в остальном такой же как и все ленты.	1
Отличный магазин с большим ассортиментом продукции. Мне он очень нравится.	1
В таком огромном городе , такой убогий парк	0
Очень большой магазин, с богатым ассортиментом и приемлемыми ценами.	1
даже одной звезды не заслуживает,почти все классные отракционы не работают,ужасные очереди в кассе,ну и собственно цены,ехали с другого города,чисто из-за новых впечатлений отракционов в итоге-разочарование	0
Мне понравилось место! Смотрели постановку Пер Гюнт)	1
По сравнению с Лентой на Кирзаводской, здесь есть: 1: Большой ассортимент из-за большого пространства. 2: Эко-маркет. 3: Куча других подразделов продуктов. 4: Расстановка витрин и полок. Ставлю 5+	1
Обязательно к помещению! Была на постановке Лебединое озеро. Неописуемый восторг!	1
Очень классный музей, интересен и взрослым и детям	1
Огромный ассортимент, цены демократичным, часто бывают акции, качество продуктов и пр. товаров не вызывает нареканий, удобная организация торгового зала. Есть кафе, много банкоматов.	1
Разочаровалась окончательно в этом супермаркете, очень дорого, и почему то все время хотят обмануть со своими акциями , одно вранье ((	0
Классный магазин, каждый день заезжаю!	1
Хороший гипермаркет,  много товаров по приемлемым ценам,  постоянно проводятся скидки.	1
Огромный выбор товара! Вежливое обслуживание на кассе!	1
Есть большой и малый залы. В здании находится Арт-кафе	0
За такую цену (тариф 2взр+1реб = 300р) мы гуляли два часа.. очень уютно и аккуратно, экспонатов куча, есть даже скилет мамонта, ребенок в восторге) сотрудники более чем дружелюбны и ненавязчивы) никогда не была в этом музее думала там скучно, как же сильно я ошибалась)	1
Очень хороший магазин, много выбора, хороший обслуживающий персонал. Огромная парковка. И на территории много еще чего, например автомойка, суши, банкоматы и т. д.. Мне нравиться!	1
Музей хороший, интересный.	1
Очень интересная экспозиция. Правда ценник завысили немного.	1
Грандиозное место. Был на балете Дон Кихот впечатления невероятные. Конечно, Новосибирцам повезло иметь такое заведение. Всем гостям города советую первым делом посетить это место. Лицо Новосибирска.	1
Хороший гипермаркет, все необходимое всегда в наличии, с картой "Лента" цены ниже на 10-15%	1
Очень хорошая акустика и амфитеатр кресел. С любого места видно и слышно всё. Зал прерасен, сохранены элементы советской архитектуры. Для любителей фотографий в злачных местах есть прекрасные голобые бархатные кресла на втором этаже.	1
